country,date,name,price,weight
ni,2022-04-03,chicharron yummies rancho auntenticos ,62,0.1
ni,2022-04-03,azucar san antonio regular ,65,20.0
ni,2022-04-03,mermelada callejas de guayaba ,47,0.28
ni,2022-04-03,maggi consomé de pollo  sobres de g,13,0.01
ni,2022-04-03,sardina bumblee bee salsa picante,29,0.16
ni,2022-04-03,cremaeat value para cafe original ,145,1.0
ni,2022-04-03,frijol ducal rojo molido doy pack ,70,0.99
ni,2022-04-03,carne chuck roll de res tipo americano ,123,
ni,2022-04-03,crema la completa acida gr,20,0.23
ni,2022-04-03,yogurt yes kidseen fresa ,18,0.1
ni,2022-04-03,bebida silk almendra original ,150,0.95
ni,2022-04-03,yogurt la perfecta bat ciruela ,19,0.12
ni,2022-04-03,bebida vegetaleat value de almendra tetra ,100,0.95
ni,2022-04-03,leche eskimo cacao ,37,0.47
ni,2022-04-03,leche eskimo sabor a chocolate ,9,0.2
ni,2022-04-03,yogurt yes líquido uva ,22,0.2
ni,2022-04-03,leche eskimo cacao / gal,116,0.0
ni,2022-04-03, pack leche sabemas descremada uht ,180,6.0
ni,2022-04-03,yogurt lala batido fresa y mora,17,0.12
ni,2022-04-03,la lechera leche condensada lata g,62,0.38
ni,2022-04-03,crema palmito pura natural gr,47,0.45
ni,2022-04-03,queso lunchitas blanco  slices,42,0.27
ni,2022-04-03,leche eskimo ultrapasteurizado semidescremada %asa  lt,41,
ni,2022-04-03,crema para peinar pantene prov rizos definidos ,135,0.3
ni,2022-04-03,jabon tocador dk frutos y yogurt,80,0.4
ni,2022-04-03,shampoo head & should  en suave y manejable ,354,1.0
ni,2022-04-03,maquina afeitar simply venus  blister   unidades,85,
ni,2022-04-03,crema ora dental complete menta ,77,0.1
ni,2022-04-03,jabon de tocador  dk cremoso,80,0.4
ni,2022-04-03,shampoo pantene prov liso extremo ,184,0.4
ni,2022-04-03,shampoo pantene prov control caída  lt,343,
ni,2022-04-03,en shampoo con acondicionador pantene prov cuidado clásico  lt,343,
ni,2022-04-03,acondic herbal essences prolongalo,120,0.3
ni,2022-04-03,cepillo dent oral b complete   unidades,91,
ni,2022-04-03,shampoo head&shoulders old spice ,212,0.38
ni,2022-04-03,jabón líquido corporal palmolive luminous oils higo y orquídea blanca sensación refrescante ,123,0.39
ni,2022-04-03,rexona clinical deo barra clean pk g,112,0.05
ni,2022-04-03,jabón de tocador palmolive naturals tono perfecto nacar y vitamina c  g  pack,59,0.1
ni,2022-04-03, pack jabón de tocador antibacterial protex limpieza profunda  g,75,0.11
ni,2022-04-03,jabón de tocador palmolive naturals mixto  g  pack,71,0.1
ni,2022-04-03,pasta dental colgate natural extracts purificante carbón activado  ,80,0.09
ni,2022-04-03,panal slip desechable tena mediano  unidades,387,
ni,2022-04-03,complemento ensure advance sabor a vainilla,531,0.4
ni,2022-04-03,panal para adulto tena slip mediano  unidades,630,
ni,2022-04-03,lubricante vive sabor natural ml,88,0.12
ni,2022-04-03,ropa interior tena discret talla m  unidades,308,
ni,2022-04-03,pañal depend plenitud classic renovado talla m  unidades,182,
ni,2022-04-03,pañales para adulto affective activo mediano   unidades,525,
ni,2022-04-03,vilfil alcohol % gel ,84,0.24
ni,2022-04-03,jarabe neuro fortan infasa para niñosml,132,0.24
ni,2022-04-03,pañal para adulto plenitud classic talla g  unidades,182,
ni,2022-04-03,inyeccion de planificacion mesigyna ml,200,0.0
ni,2022-04-03,suero oral con electrolitos diabetic finlay sabor naranja,48,0.5
ni,2022-04-03,suplemento de multivitaminas immuvit calcio rowe plus q unidad,17,
ni,2022-04-03,pants tena desechable mediano  unidades,327,
ni,2022-04-03,talco fungizol con clotrimazol al %gr,66,0.06
ni,2022-04-03,jarabe nutrison para adulto jerez ml,125,0.24
ni,2022-04-03,isoprinosine newport mg x tab,25,
ni,2022-04-03,famodil newport mg x  tabletas,7,
ni,2022-04-03,set gancho mainstays madera prensa   piezas,170,
ni,2022-04-03,mainstays kids vaso plastico set pcs,69,
ni,2022-04-03,prensas mainstays de ropa silicon  piez,70,
ni,2022-04-03,cuchara george home negra,95,
ni,2022-04-03,tazon duo c/division (. tz/) guateplast tr marfil tr. ,50,0.62
ni,2022-04-03,basurero uchosa con tapa buzon wm  lt,170,
ni,2022-04-03,infusor metalico mainstays para té  unidad,39,
ni,2022-04-03,exprimidor limon mainstays color amarillo  unidad,63,
ni,2022-04-03,ahorrador espiral w luz blanca,70,
ni,2022-04-03,tendedero mainstays  prensas ovalado  unidad,85,
ni,2022-04-03,alfomra de plastico blanco lavatrastos,55,
ni,2022-04-03,espatula para pastel tramontina,39,
ni,2022-04-03,abrelatas reforzado econom nuevo clasica,185,
ni,2022-04-03,batería rayovac alcalina aaa   unidades,196,
ni,2022-04-03,marcadores infantiles pen+gear  piezas,27,
ni,2022-04-03,marcador crayola wonder  colores,140,
ni,2022-04-03,crayon jumbo crayola de cera   unidades,130,
ni,2022-04-03,batidor para cocina mainstays,49,
ni,2022-04-03,salsa lizano picante ,27,0.06
ni,2022-04-03,boquita yummies platanos y chicharron ,46,0.15
ni,2022-04-03,galleta pozuelo tosh coco almendra  .gr,93,0.0
ni,2022-04-03,champiñones sabemas rebanados ,43,0.18
ni,2022-04-03,salsa lizano criolla botella ,115,0.7
ni,2022-04-03,aceite clover de soya ,200,2.0
ni,2022-04-03,paleta ricolino payaso malvav mini,17,0.02
ni,2022-04-03,tajadas laanja de platano ,67,0.3
ni,2022-04-03,aceite olivaeat value spray ,111,0.2
ni,2022-04-03,nestle corn flakes sin gluten cereal bolsa g,187,0.8
ni,2022-04-03,sopa maruchan ramen camaron picante ,29,0.06
ni,2022-04-03,galleta pozuelo salada club extra ,31,0.22
ni,2022-04-03,pasta roma canelon ,38,0.25
ni,2022-04-03,frijol naturas molido rojo ,52,0.4
ni,2022-04-03,pasta roma corta cabellos ,37,0.25
ni,2022-04-03,harina premiun trigo ,47,1.36
ni,2022-04-03,pasta roma tornillos tricolor ,41,0.25
ni,2022-04-03,maggi sopa de pollo con caracolitos sobre g,12,0.06
ni,2022-04-03,snack tosh tomate parmesano g,105,0.16
ni,2022-04-03,aceiteeat value soya ,310,3.5
ni,2022-04-03,ajo sabemas en polvo bolsa ,8,0.02
ni,2022-04-03,galleta sabemas maria ,21,0.17
ni,2022-04-03,mayonesagreat value squeeze ,89,0.53
ni,2022-04-03,galleta rellena de fresa suli  g,21,0.25
ni,2022-04-03,salsa tomate sabemas con hongos ,11,0.11
ni,2022-04-03,siropeeat value maple original ,121,1.07
ni,2022-04-03,snack yummies taquerito queso fusio ,35,0.18
ni,2022-04-03,cafe selecto molido clasico ,119,0.4
ni,2022-04-03,coco sol maya rallado ,52,0.08
ni,2022-04-03,te manzanilla manzate caja  unidades ,168,0.12
ni,2022-04-03,granola naturalez fibra especial ,57,0.28
ni,2022-04-03,cebada sasa instantanea ,34,0.4
ni,2022-04-03,granola alin bolsa ,51,0.25
ni,2022-04-03,arroz / carolina ,209,4.0
ni,2022-04-03,coffee mate original en polvo tarro g,80,0.31
ni,2022-04-03,salsa suli vegetales tipo inglesa,49,0.7
ni,2022-04-03, pack papas pringles muelitas original ,190,0.23
ni,2022-04-03,cafe selecto reserva ,170,0.4
ni,2022-04-03,aceite de oliva xtra virgen ybarra,70,0.25
ni,2022-04-03,maggi sopa criolla de gallina con caracolitos sobre g,12,0.06
ni,2022-04-03,snack tosh sal marina g,105,0.16
ni,2022-04-07,azucar mote rosa sulfitada ,60,2.0
ni,2022-04-07,arroz el faisan  ,99,2.0
ni,2022-04-07,azucar golden brown morena ,75,2.0
ni,2022-04-07,frijol sabemas rojo ,111,1.82
ni,2022-04-07,,17,
ni,2022-04-07,maggi sopa de pollo con fideos sobre g,12,0.06
ni,2022-04-07,jalea callejas de guayaba ,52,0.28
ni,2022-04-07,harina para pancake aunt jemima original,56,0.4
ni,2022-04-07,aceite mazola natural blend ,74,0.8
ni,2022-04-07,galleta pozuelo maria  unidades ,52,0.25
ni,2022-04-07,arroz faisan ,430,11.34
ni,2022-04-07,avena sabemas en hojuelas ,59,1.0
ni,2022-04-07,galleta waffer gama gama,47,0.24
ni,2022-04-07,arroz tio pelonano entero  ,79,2.0
ni,2022-04-07,arroz / el faisan ,335,6.8
ni,2022-04-07,pasta roma lengua ,17,0.2
ni,2022-04-07, pack de galleta de maiz sanissimo salmas ,61,0.14
ni,2022-04-07,vinagre sabemas claro ,20,0.7
ni,2022-04-07, pack de galleta nabisco chips ahoy ,94,0.34
ni,2022-04-07,avena sasa molida ,33,0.4
ni,2022-04-07,carne molida   empacada  ,100,0.45
ni,2022-04-07,muslo deshuesado fresco ,67,
ni,2022-04-07,posta de cerdo don cristobal  ,81,
ni,2022-04-07,filete don cristobal de pollo sin piel empacado  ,95,0.45
ni,2022-04-07,pierna de pollo tip top fresca bandeja  piezas,58,
ni,2022-04-07,chuleta de cerdo don cristobal ,93,
ni,2022-04-07,carne de cerdo don cristobal para asar ,90,
ni,2022-04-07,lomo de cerdo la hacienda ,115,
ni,2022-04-07,bistec tenderizado de res empacado  ,119,0.45
ni,2022-04-07,cabeza de lomo  ,143,0.45
ni,2022-04-07,costilla don cristobal de cerdo ,115,
ni,2022-04-07,filete al ajillo don cristobal empacado,92,
ni,2022-04-07,bistec especial don cristobal,132,
ni,2022-04-07,piernas de pollo tip top congeladas ,163,1.36
ni,2022-04-07,filete dela isla tilapia bolsa  .,224,2.27
ni,2022-04-07,trasera de lomo empacada ,130,
ni,2022-04-07,titiles de pollo fresco  ,45,0.45
ni,2022-04-07,costilla don cristobal entera de cerdo  ,120,0.45
ni,2022-04-07,muslo mejorado  ,59,0.45
ni,2022-04-07,trozos de cerdo don cristobal  ,88,0.45
ni,2022-04-07,salon blanco  ,116,0.45
ni,2022-04-07,bistec adobado criollo especial empacado ,127,
ni,2022-04-07,posta de cerdo empacado,84,
ni,2022-04-07,caracu  ,89,0.45
ni,2022-04-07,crema acida la perfecta bolsagr,35,0.42
ni,2022-04-07,cajilla de huevo san francisco blanco  unidades,147,
ni,2022-04-07,mantequilla eskimo barra ,45,0.1
ni,2022-04-07,mantequilla dos pinos barra  ,48,0.12
ni,2022-04-07,media cajilla de huevo blanco barranca  unidades,83,
ni,2022-04-07,leche sabemas deslactosada ultrapasteurizada y homogenizada ,34,1.0
ni,2022-04-07,leche lala ultrapasteurizada deslactosada ,47,1.0
ni,2022-04-07,yogurt yesiego cremoso fresa sin azúcar ,35,0.15
ni,2022-04-07,quesoeat value cheddar rallado ,85,0.23
ni,2022-04-07,leche eskimo ultrapasteurizada entera larga vida %asa ,32,0.9
ni,2022-04-07,leche dos pinos delactomy descremada %asa ,50,1.0
ni,2022-04-07,leche eskimo vidamas formula lactea,28,0.9
ni,2022-04-07,yogurt yesiego cremoso mango sin azúcar gr,37,0.15
ni,2022-04-07,quesoeat value mozzarella rallado ,98,0.23
ni,2022-04-07,queso monte fresco seco ,90,0.45
ni,2022-04-07,yogurt dos pinos deligurt in line natural  ,57,0.5
ni,2022-04-07,leche lala ultrapasteurizada entera ml,47,1.0
ni,2022-04-07,queso crema dos pinos americano gr,34,0.1
ni,2022-04-07,leche dos pinos pinito  ,50,1.0
ni,2022-04-07,queso suli procesado tipo americano  slicesgr,27,0.17
ni,2022-04-07,quesillo la completa en trenza ,124,0.34
ni,2022-04-07,queso palmito mozzarella rallado ,62,0.2
ni,2022-04-07,leche sabemas ultrapasteurizada entera .%asa ,33,1.0
ni,2022-04-07,queso parmesanoeat value en polvo botegr,150,0.23
ni,2022-04-07,pasta dental colgate total clean mint ,98,0.15
ni,2022-04-07,pasta dental colgate triple acción ,25,0.08
ni,2022-04-07,pasta dental colgate max white complete clean  ,114,0.16
ni,2022-04-07, pack jabón de tocador antibacterial protex avena  g,129,0.11
ni,2022-04-07,desodorante rexona barra men v,59,0.05
ni,2022-04-07,jabon equa tocador ultra fresh pk,56,0.11
ni,2022-04-07,rasuradora gillette permasharp ea,18,
ni,2022-04-07, pack jabón de tocador antibacterial protex mix   g,129,0.11
ni,2022-04-07,pasta dental colgate smiles minions + años ,81,0.08
ni,2022-04-07,desodarante rexona barra powder ,40,0.05
ni,2022-04-07,toallas femeninas,45,
ni,2022-04-07,shampoo palmolive optims nivel  extra intensivo  en  ,151,0.7
ni,2022-04-07,toalla saba nocturna ultradelgada ea,55,
ni,2022-04-07,toalla sanitaria kotex esencial sin alas aloe   unidades,25,
ni,2022-04-07,shampoo savile con sabila y aguacate ,105,0.55
ni,2022-04-07, pack crema dental crest scope frescura de menta ,115,0.31
ni,2022-04-07,jabón de tocador palmolive naturals humectación refrescante sandía y lychee  g  pack,63,0.1
ni,2022-04-07,desodorante speed stick sport talc barra  g,61,0.05
ni,2022-04-07,protector kotex diario largo   unidades,108,
ni,2022-04-07,jabon de tocador  dk avena,80,0.4
ni,2022-04-07,alcohol clinico santi ml,145,1.75
ni,2022-04-07,alcohol clinico santi,95,1.0
ni,2022-04-07,suero electrolit sabor a naranja mandarina,98,0.62
ni,2022-04-07,alka seltzer regular   tabletas,49,
ni,2022-04-07,complemento alimenticio ensure advance vanilla ,1,0.85
ni,2022-04-07,capsulas aleve extra fuerte   unidades,89,
ni,2022-04-07,crema ceguel clomazol gr,37,0.04
ni,2022-04-07,spray dermalcol,27,0.06
ni,2022-04-07,bicarbonato de sodio paquete,23,
ni,2022-04-07,torunda medimart jumbo  piezas,37,
ni,2022-04-07,vive condon original  unidades,29,
ni,2022-04-07,alkaad   unidades,81,
ni,2022-04-07,complemento alimenticio glucerna vanilla rpb ml,117,0.24
ni,2022-04-07,suero electrolit rehidratante uva ,98,0.62
ni,2022-04-07,condones durex maximo placer  unidades,83,
ni,2022-04-07,complemento alimenticio ensure ng chocolate ,478,0.4
ni,2022-04-07,complemento alimenticio ensure ng vanilla ,478,0.4
ni,2022-04-07,complemento alimenticio pediasure vainilla ,530,0.4
ni,2022-04-07,suero electrolit rehidratante fresa kiwi ,98,0.62
ni,2022-04-07,algodón plisado zuum  g,31,0.05
ni,2022-04-07,condón durex climax mutuo x   unidades,98,
ni,2022-04-07,dorival liquid gel   tabletas,88,
ni,2022-04-07,agua oxigenada lacofa ,36,0.12
ni,2022-04-07,fosforos el aguila   unidades,22,
ni,2022-04-07,fosforos suli de madera   cajitas,14,
ni,2022-04-07,taburete handi works plegable,280,
ni,2022-04-07,botella atomizador home pro  ,65,0.55
ni,2022-04-07,canasta para ropa mainstays con tapa   lt,25,
ni,2022-04-07,toalla de manos blanca marca milenium x pulgadas % algodón,40,
ni,2022-04-07,recipiente mainstays de vidrio con seguro ,65,0.31
ni,2022-04-07,canasta rectangular ( l) guateplast marfil ,150,
ni,2022-04-07,set de bowls mainstays para mezclar  unidad,175,
ni,2022-04-07,afilador de cuchillo ilko,159,
ni,2022-04-07,baterías alcalina rayovac  aa   unidades,211,
ni,2022-04-07,ganchos mainstays set  und blanco,90,
ni,2022-04-07,mesa mainstays plegable plastica negra  .cm,1,
ni,2022-04-07,mb cama tamano queen orthopremi p,13,
ni,2022-04-07,parrilla expertill de gas de   quemadores,8,
ni,2022-04-07,"silla secretarial mainstays, con brazos, respaldo mesh, * * cm, ys",3,
ni,2022-04-07,hervidor  cm mainstays,170,
ni,2022-04-07,mainstays set pajilla metal p c cepillo,69,
ni,2022-04-07,organizador lavanderia mainstays azul,35,
ni,2022-04-07,plastilina baco con  barras de colores,18,
ni,2022-04-07,carbon mi vegetal carbon  kg,75,
ni,2022-04-07,block rayado escolar tamano carta  hojas,25,
ni,2022-04-07,cuaderno norma cosidoande rayado jean book  hojas,110,
ni,2022-04-07,galleta marinela sponch fresa ,61,0.36
ni,2022-04-07,frijol suli rojo ,106,1.82
ni,2022-04-07,cubito maggi de pollo sazonador  unidades de,26,0.0
ni,2022-04-07,avena quaker mosh hojuelas ,33,0.3
ni,2022-04-07,pinolillo sabemas ,25,0.4
ni,2022-04-07,azucar san antonio refinada ,75,2.0
ni,2022-04-07,galleta pozuelo canasta guayaba ,49,0.26
ni,2022-04-07,pasta roma plumas ,23,0.2
ni,2022-04-07,galleta suli rellena de vainilla gr,21,0.25
ni,2022-04-07, pack galleta oreo golden de vainilla ,88,0.43
ni,2022-04-07,frijol sabemasanel rojo  ,21,0.45
ni,2022-04-07,galleta pozuelo soda  unidades ,26,0.18
ni,2022-04-07,galleta pozuelo chiky chocolate ,69,0.48
ni,2022-04-07,galleta nabisco ritz  .gr,63,0.01
ni,2022-04-07,maizeat value lata  .oz ,42,0.25
ni,2022-04-07,harina bollo fino de trigo ,66,2.0
ni,2022-04-07,arroz carolinaano entero,81,2.0
ni,2022-04-07,arroz suli aanel  ,15,0.45
ni,2022-04-07,menudo de pollo mixto fresco  ,20,0.45
ni,2022-04-07,cola de res don cristobal  ,78,0.45
ni,2022-04-07,carne de res para asar  ,119,0.45
ni,2022-04-07,costilla alta de res  ,85,0.45
ni,2022-04-07,filete nicalapia de pargo bolsa  ,335,0.91
ni,2022-04-07,carne molida de cerdo don cristobal  ,90,0.45
ni,2022-04-07,pierna de pollo sola fresca ,54,
ni,2022-04-07,torta de pescado caf bolsa ,86,0.45
ni,2022-04-07,carne molida de pollo fresco,69,
ni,2022-04-07,carne don cristobal trasera de lomo  ,130,0.45
ni,2022-04-07,pargo nicalapia entero rojo  / a  ,195,0.45
ni,2022-04-07,filete de corvina empacado al vacio .oz  ,449,0.91
ni,2022-04-07,alitas suave picantes  ,79,0.45
ni,2022-04-07,carne cerdo don cristobal asar empacado  ,90,0.45
ni,2022-04-07,lomoande de exportacion don cristobal,149,
ni,2022-04-07,filete mignon don cristobal libra,170,
ni,2022-04-07,bistec tenderizado  ,118,0.45
ni,2022-04-07,posta de pierna fresca  ,128,0.45
ni,2022-04-07,yogurt la perfecta bebible fresa ,22,0.2
ni,2022-04-07,yogurt yoplaitiego batido natural ,170,1.0
ni,2022-04-07,cajeta la perfecta de leche ,21,0.1
ni,2022-04-07,queso lunchita amarillo  unidades ,50,0.27
ni,2022-04-07, pack yogurt yes cool fresa ,65,0.12
ni,2022-04-07,leche eskimo ultrapasteurizada deslactosada %asa   litro,41,
ni,2022-04-07,queso parmesano la norteña ,103,0.22
ni,2022-04-07,bebida delisoya sin lactosa ,215,0.8
ni,2022-04-07, pack de leche saborizada eskimo surtido ml,68,0.2
ni,2022-04-07,bebida silk almendra sin azucar ,150,0.95
ni,2022-04-07,leche eskimo ultrapasteurizada descremada %asalt,41,
ni,2022-04-07,quesoeat value cheddar rodajado  slices,92,0.23
ni,2022-04-07,queso cremaeat value regular ,57,0.23
ni,2022-04-07,queso crema dos pinos ,62,0.21
ni,2022-04-07, pack bebida shaka laka surtida ,67,1.2
ni,2022-04-07,leche la completa uht entera ,41,1.0
ni,2022-04-07,leche evaporada nestle ideal® entera lata gr,59,0.32
ni,2022-04-07, pack leche lala entera ml,225,1.0
ni,2022-04-07,jabon dove original  pack,199,0.54
ni,2022-04-07,desodorante bamboo barra rexona,40,0.05
ni,2022-04-07,enjuague equate bucal blue mint ,130,1.5
ni,2022-04-07,shampoo dove reconstrucc complet,259,1.15
ni,2022-04-07, pack desodorante dove dama dermoaclarant ,127,0.1
ni,2022-04-07,shampoo elvive brillo sedosidad ,135,0.4
ni,2022-04-07,desodorante dove barra dama dermo aclarado ,74,0.05
ni,2022-04-07,toallas femeninas kotex nocturna sin alas  unidades,43,
ni,2022-04-07,jabon equate protecc intensa pack,25,0.44
ni,2022-04-07,panuelo facial kleenex ejecutivo u,66,
ni,2022-04-07,pañueloeat value facial everyda   unidades,91,
ni,2022-04-07,jabón equate líquido para manos milk & honey  .lt,31,
ni,2022-04-07,desodorante rexona clinical barra clasica pk g,112,0.05
ni,2022-04-07,shampoo acondicionador head and shoulder crece,304,0.38
ni,2022-04-07, pack jabón de tocador antibacterial protex aloe  g,75,0.11
ni,2022-04-07,pasta dental colgate natural extracts detox coco y jengibre ,50,0.09
ni,2022-04-07,shampoo sedal antinudos,189,0.84
ni,2022-04-07,tena pants nocturno talla m  unidades,264,
ni,2022-04-07,jalea ciruelax laxante de origen vegetal,190,0.3
ni,2022-04-07,minitabs ciruelax comprimidos recubiertos  unidades,106,
ni,2022-04-07,ciruelax forte  comprimidosmg,190,
ni,2022-04-07,suero electrolit adulto lima limon,104,0.62
ni,2022-04-07,jarabe alitoz expectorante miel ml,85,0.12
ni,2022-04-07,unguento topico vick vaporub gr,127,0.1
ni,2022-04-07,complemento alimenticio ensure ng fresa ,1,0.85
ni,2022-04-07,alcohol equate gel antibacterial aloe ,55,0.3
ni,2022-04-07,nebulizador buho rosado,1,
ni,2022-04-07,pañal plenitud active plus p/m   unidades,376,
ni,2022-04-07,tabcin efervescente adulto   unidades,62,
ni,2022-04-07,aspirina adulto   tabletas,31,
ni,2022-04-07, packs cubreboca vilgatex,60,
ni,2022-04-07,doble redoxon accion sabor a naranja  tabletas,168,
ni,2022-04-07,lubricante vive sabor fresa ml,88,0.12
ni,2022-04-07,vitamina c renuvit mg  capsulas,5,
ni,2022-04-07,set de perchas de metal pz,155,
ni,2022-04-07,pesa digital mainstays para cocina   unidad,355,
ni,2022-04-07,basurero better homes&garde cromado redondo   lts,315,
ni,2022-04-07,bateria duracell alcalina aa basico   unidades,252,
ni,2022-04-07,porta cubiertos mainstays con tapa,180,
ni,2022-04-07,hielera igloo laguna  qt roller,2,
ni,2022-04-07,canister vidrio mediano mainstays,85,
ni,2022-04-07,megaplast maceta plastica violeta no.,30,
ni,2022-04-07,set  utensilios mainstays madera  unidad,125,
ni,2022-04-07,manga con dullas mainstays  unidad,60,
ni,2022-04-07,set  prensas acero mainstays,55,
ni,2022-04-07,megaplast maceta fiore con plato no.,45,
ni,2022-04-07,abrelatas reforzado econom nuevo clasica,185,
ni,2022-04-07,molde queque mainstays,100,
ni,2022-04-07,afilador mainstays con mango,29,
ni,2022-04-07,flor de jamaica sabemas deshidrata ,41,0.1
ni,2022-04-07,hongo richly trozos ,61,0.18
ni,2022-04-07,galleta sanissimo chia linaza gr,61,0.14
ni,2022-04-07,maggi sopa criolla de costilla de res sobre g,12,0.06
ni,2022-04-07,harina de maiz maseca bolsa ,21,0.45
ni,2022-04-07,crema dulce dos pinos  ,50,0.25
ni,2022-04-07,mezclaeat value panqueques original ,90,0.91
ni,2022-04-07,aceite ambar de soya,334,3.78
ni,2022-04-07,galleta pozuelo dul mantequilla ,63,0.31
ni,2022-04-07,frijol sabemasano rojo ,67,0.9
ni,2022-04-07,harina suli para pancake ,45,0.45
ni,2022-04-07,cebada sasa bolsa ,33,0.4
ni,2022-04-07,salsa inglesa mccormick ,82,0.3
ni,2022-04-07,vinagre sabemas claro,77,3.78
ni,2022-04-07,miel aunt jemma original pancake ,82,0.36
ni,2022-04-07,arroz tio pelonano entero / ,95,2.0
ni,2022-04-07,galleta pozuelo crema rellena vainilla ,46,0.38
ni,2022-04-07,hueso rojo especial  ,20,0.45
ni,2022-04-07,carne molida don cristobal cerdo empacado  ,90,0.45
ni,2022-04-07,posta de corona fresca  ,128,0.45
ni,2022-04-07,camaron precocido dela isla .,398,2.27
ni,2022-04-07,posta de corona empacada  ,128,0.45
ni,2022-04-07,trozos cerdo la hacienda bbq empacado  ,97,0.45
ni,2022-04-07,salon blanco empacado  ,116,0.45
ni,2022-04-07,bistec de cerdo don cristobal ,92,
ni,2022-04-07,filete dorado congelado .oz .,288,2.27
ni,2022-04-07,carne cecina  ,93,0.45
ni,2022-04-07,bistec de cerdo pimienta con limon la hacienda ,91,
ni,2022-04-07,carne marketside new york steak tipo americano especial para parrill  ,197,
ni,2022-04-07,camaron nicalapia pre cocido   ,301,15.88
ni,2022-04-07,bistec cerdo parrillero empacado ,91,
ni,2022-04-07,carne tri tip la hacienda tipo americano  ,140,0.45
ni,2022-04-07,posta de pierna empacada  ,128,0.45
ni,2022-04-07,margarina mazola ,51,0.4
ni,2022-04-07,queso la cabana de crema ahumado ,115,0.68
ni,2022-04-07,yogurt yes cremoso fruta al fondo cherry ,19,0.12
ni,2022-04-07,leche instantánea nestlé® nido® + protección® alimento complementario en lata .kg,619,
ni,2022-04-07,leche dos pinos delactomy semidescremada %asa  ,50,1.0
ni,2022-04-07,quesoeat value parmesano ralladado ,98,0.17
ni,2022-04-07,leche dos pinos polvo pinito  ,233,0.8
ni,2022-04-07,margarina numar ajo con perejil ,60,0.2
ni,2022-04-07,yogurt yesiego cremoso natural ,37,0.15
ni,2022-04-07,queso la completa rallado mozzarella ,82,0.22
ni,2022-04-07,yogurt infantil fresa choco colores gr,41,0.13
ni,2022-04-07,leche nestlé® nido en polvo + advanced® lata gr,245,0.8
ni,2022-04-07,yogurt yoplaitiego con moras ,33,0.14
ni,2022-04-07,yogurt yes líquido safari fresa ,17,0.1
ni,2022-04-07,natilla dos pinos laanja sin sal  ,28,0.3
ni,2022-04-07,queso dos pinos procesado tipo americano  rebanadas  ,74,0.19
ni,2022-04-07,queso crystal farms pepper jack trozo ,150,0.23
ni,2022-04-07,queso crystal farms mozarella rallado ,149,0.23
ni,2022-04-07,jabon equate antibacterial surt p,56,0.44
ni,2022-04-07,toalla saba teens nocturna  ea,40,
ni,2022-04-07,pack sedal hair cream de peinar rizosml y,157,0.3
ni,2022-04-07,acondicionador savile sabilay aguacate ,107,0.53
ni,2022-04-07,acondic sedal rizos definidos,112,0.34
ni,2022-04-07,shampoo head shoulders en suave,129,0.18
ni,2022-04-07,shampoo herbal essenc en prolong,127,0.3
ni,2022-04-07,borla para baño ttaio textura rigida   unidad,30,
ni,2022-04-07,hilo dental colgate total menta y flúor  mts,83,
ni,2022-04-07,enjuague bucal colgate total anti sarro ,312,0.5
ni,2022-04-07, pack cepillo dental colgate zigzag charcoal infusión de carbón,84,
ni,2022-04-07,desodor rexona barra men antib reg,59,0.05
ni,2022-04-07,desodor rexona barra men sportfan,59,0.05
ni,2022-04-07,toalla saba sanitaria ultradelgadas con alas   unidades,69,
ni,2022-04-07,kotex toalla nocturn,145,
ni,2022-04-07,dove jab revigorizanteanada pk g,105,0.09
ni,2022-04-07,talco medicado tph para pies bolsa,34,0.12
ni,2022-04-07,hisopos medimart bolsa  piezas,29,
ni,2022-04-07,locion sani pies para piesml,130,0.08
ni,2022-04-07, pack de profilactico vive retardante,44,
ni,2022-04-07,ungüento zepol para resfrios adulto,94,0.06
ni,2022-04-07,fungicida tph para unas ml,64,0.03
ni,2022-04-07,jarabe andifar extracto de malta,124,0.25
ni,2022-04-07,tabletas dorival mg   unidades,55,
ni,2022-04-07,tabcin de noche   capsulas de gelatina,122,
ni,2022-04-07,ungüento zepol adulto g,111,0.09
ni,2022-04-07,algodon medimart plisado,27,0.05
ni,2022-04-07,crema zepol deportista muscular g,98,0.06
ni,2022-04-07,zepol infantil unguento,49,0.03
ni,2022-04-07,suero electrolit rehidratante adulto coco ,94,0.62
ni,2022-04-07,venditas medimart adhesivas caja   unidades,25,
ni,2022-04-07,spray fungil fungicida para pies,85,0.06
ni,2022-04-07,fungicida tph para pies locion,66,0.12
ni,2022-04-07,hamaca mainstays de tela con base color beige,3,
ni,2022-04-07,parrilla p redonda,729,
ni,2022-04-07,"librera mainstays,  divisiones, . x . x .cm, ms",2,
ni,2022-04-07,"silla ejecutiva con brazos mainstays, respaldo mesh, inclinación y apoya cuello, . x  x cm, ysca",3,
ni,2022-04-07,mainstays olla  cm,150,
ni,2022-04-07,bolsas reutilizables con cierre pza ms,110,
ni,2022-04-07,cortinero plata satin silver  ,169,
ni,2022-04-07,block de construccion sysabe hojas,90,
ni,2022-04-07,"librera mainstays,  divisiones,  x .x . cm, msd",1,
ni,2022-04-07,funda para parrilla backyardill   pulgadas,419,
ni,2022-04-07,great value briquetas carbon bolsa  k,95,
