country,date,name,price,weight
nic,2/11/2022,crema nutella avellanas con cacao ,292,0.35
nic,2/11/2022,atun gaviota lomo trocitos c veget,56,0.1
nic,2/11/2022,siropeeat value maple suga free ,79,0.71
nic,2/11/2022,pasas sabemas bolsa ,31,0.12
nic,2/11/2022,galleta sabemas maria ,19,0.17
nic,2/11/2022,cafe casa del cafe molido vainilla ,202,0.4
nic,2/11/2022,galleta rellena de fresa suli  g,21,0.25
nic,2/11/2022,harina sabemas de maiz ,81,2.27
nic,2/11/2022,frijol ducal rojo molido doy pack ,70,0.99
nic,2/11/2022,galleta pozuelo dul mantequilla ,63,0.31
nic,2/11/2022,sopa pollo con fideos libre de gluten maggi ,14,0.06
nic,2/11/2022,galleta pozuelo cremas dark ,66,0.4
nic,2/11/2022,aceiteeat value mantequi spray ,82,0.23
nic,2/11/2022,palomitaeat value microo extramantequilla ,28,0.08
nic,2/11/2022,sopa nissin instantanea pollo vaso ,20,0.06
nic,2/11/2022,boquitas yummies nacho con queso ,31,0.15
nic,2/11/2022,aceitegreat value oliva extra virgen ,118,0.5
nic,2/11/2022,mostaza suli preparada en bolsa ,32,0.44
nic,2/11/2022,pasta dental colgate total encías reforzadas ,73,0.08
nic,2/11/2022,pasta dental colgate luminous white brilliant  ,124,0.12
nic,2/11/2022,tinte igora vital  rubi,188,0.05
nic,2/11/2022,tinte igora vital   castaño,195,0.05
nic,2/11/2022,secadora remington de cabello profesional,1,
nic,2/11/2022,shampoo head&shoulder cocoml y cppml pk,308,0.38
nic,2/11/2022,pimienta maggi de la huerta frasco g,63,0.06
nic,2/11/2022,consome maggi pollo tarro s,51,0.22
nic,2/11/2022,especie sabemas pimienta negra molida ,10,0.02
nic,2/11/2022,salsa china mccormick ,91,0.3
nic,2/11/2022,galleta sabemas dulce mantequilla ,53,0.31
nic,2/11/2022,nestle cinnamon toast crunch® canela cereal g caja,146,0.34
nic,2/11/2022,nestle lucky charms® con malvaviscos cereal g caja,147,0.3
nic,2/11/2022,papitas yummies estilo clasico,41,0.08
nic,2/11/2022,boquitas de yucas tostadas hores,67,0.22
nic,2/11/2022,te jengibre limon mondaisa caja undm,72,0.03
nic,2/11/2022,gelatina royal fresa ,27,0.08
nic,2/11/2022,cafe san sebastianano oscuro ,140,0.4
nic,2/11/2022,pasta roma caracolito ,18,0.2
nic,2/11/2022,coco sol maya rallado ,48,0.08
nic,2/11/2022,arroz / faisan ,83,2.0
nic,2/11/2022,pasta roma de coditos ,21,0.2
nic,2/11/2022,granola naturalez fibra especial ,51,0.28
nic,2/11/2022,bloq nivea face prot lig fps,222,0.05
nic,2/11/2022,jabón corporal palmolive raspberry & tourmaline pack,55,0.1
nic,2/11/2022,gel de baño ivory aroma de aloe ,166,0.35
nic,2/11/2022,jabon olimpo gel antibacterial,236,3.78
nic,2/11/2022,desodora rexona barra teen tropical,59,0.05
nic,2/11/2022, pack jabón de tocador equate yogurt & arándano ,51,0.44
nic,2/11/2022,shampoo head & should  en suave y manejable ,354,1.0
nic,2/11/2022,espuma de afeitar gillette foamy mentol ,376,0.32
nic,2/11/2022,shampoo dove recuperacion extrema ,162,0.4
nic,2/11/2022,jabon eq liquido antibacterial ,45,0.52
nic,2/11/2022,garnier fructis hairfood mask aloe ,220,0.35
nic,2/11/2022,crema lubriderm extrahumectante,552,0.75
nic,2/11/2022,crema corporal equate lotion body milk ,220,0.62
nic,2/11/2022,garnier fructis hairfood mask coconut ,220,0.35
nic,2/11/2022,shampoo head & shoulders alivio refrescante ,216,0.38
nic,2/11/2022,shampoo sedal cocoml y acondiml pk,111,0.34
nic,2/11/2022,crema nivea hidratación express ,532,1.0
nic,2/11/2022,set de viaje equate  pc ea,80,
nic,2/11/2022,pasta macarron roma ,26,0.25
nic,2/11/2022,pasta roma pequeña mini plumas ,26,0.25
nic,2/11/2022,cereal kellogrgr's® choco krispis® sabor a chocolate  cereal deranos de arroz inflado   caja de,169,0.45
nic,2/11/2022,sopa res con fideos maggi ,12,0.06
nic,2/11/2022,palomitas act ii mantequilla extra ,48,0.09
nic,2/11/2022,galleta pozuelo chiky choco naran,57,0.4
nic,2/11/2022,chocolate schogetten oscuro amargo ,59,0.1
nic,2/11/2022,vinagre blanco mama gollita,26,0.7
nic,2/11/2022,pasta ramen vigui pollo,93,0.19
nic,2/11/2022,jabón asepxia bicarbonato sodio,119,0.1
nic,2/11/2022,desodor nivea spray men real impactml,105,0.15
nic,2/11/2022,gel nivea limpiador efecto mate,305,0.15
nic,2/11/2022,jabon equate liquido cucumber melon ,34,0.22
nic,2/11/2022,gel nivea facial limpieza rosas ,301,0.15
nic,2/11/2022,shampoo elvive oleo extraordinario nutricion profunda ,147,0.4
nic,2/11/2022,esponja equate mesh con base de goma,82,
nic,2/11/2022,nueva crema para peinar pantene prov liso extremo ml,135,0.3
nic,2/11/2022,gel nivea limp refresc piel normal,200,0.15
nic,2/11/2022,crema herbal essences prolongalo,119,0.3
nic,2/11/2022,tinte loreal excelle rub dor . .ml,229,0.0
nic,2/11/2022,equate antifaz de gel   unidad,58,
nic,2/11/2022,desodorante clear gel gillette cool wave  g,212,0.16
nic,2/11/2022,jabon equate ext perla y algodon  pack,51,
nic,2/11/2022,cepillos oral b interdentales micro,272,
nic,2/11/2022,cepillo dental equate gusanito para bebé   unidad,28,
nic,2/11/2022,cepillo de bolsillo equate con espejo  unidad,33,
nic,2/11/2022,panuelo facial kleenex ejecutivo u,66,
nic,2/11/2022,salsa naturas ketchup ,99,0.79
nic,2/11/2022, pack galleta sponch marinela ,58,0.36
nic,2/11/2022,comino sol maya en polvo ,19,0.01
nic,2/11/2022,achiote mama gollita molido ,19,0.12
nic,2/11/2022,aceiteeat value oliva puro ,200,0.75
nic,2/11/2022,nestle corn flakes sin gluten cereal g caja,124,0.53
nic,2/11/2022,vinagregreat value sidra manzana ,59,0.95
nic,2/11/2022,aceiteeat value de oliva virgen ,355,1.5
nic,2/11/2022,galleta pozuelo chiky chips ,69,0.24
nic,2/11/2022,galleta sanissimo arroz integral ,93,0.11
nic,2/11/2022,linaza molida sabemas ,57,0.4
nic,2/11/2022,caja de pasaseat value de uva ,125,0.34
nic,2/11/2022,granola tosh semillas y chia ,91,0.3
nic,2/11/2022,salsa tomate con sofrito sabemas ,11,0.11
nic,2/11/2022,sabemas avena en hojuela ,20,0.3
nic,2/11/2022,pancakes avena tosh,95,0.3
nic,2/11/2022, pack galleta marinela chocolate ,67,0.34
nic,2/11/2022,tomillo sm entero bolsa,17,0.01
nic,2/11/2022,rasuradora equate mango de goma homb u,85,
nic,2/11/2022,shampoo head & should old spice ,354,1.0
nic,2/11/2022,ora indicator color collection cepillos dentales suave   unidades,132,
nic,2/11/2022,desodorante barra rexona men invisible ,59,0.05
nic,2/11/2022,mascarilla intensiva herbal essences bío:renew coconut milk ,275,0.3
nic,2/11/2022,toalla kotex normal con manzanilla und,33,
nic,2/11/2022,desodorante dove spray ap clear tone ,96,0.15
nic,2/11/2022,pack equate clean care  cep  cobertor,45,
nic,2/11/2022,head shoulders coco,230,
nic,2/11/2022,protector saba diario multiestilo   unidades,59,
nic,2/11/2022,repuestos para afeitar gillette venus original   unidades,184,
nic,2/11/2022,crema nivea corp piel extra seca,528,1.0
nic,2/11/2022,hilo oral b dental cera con fluor  und,124,
nic,2/11/2022,jabon tocad equate limpi total pk,51,0.44
nic,2/11/2022, pack jabon primavera tocador mixto ,92,0.78
nic,2/11/2022,elvive óleo extraordinario nutrición universal ,147,0.1
nic,2/11/2022,crema cicatricure facial gold lift noche ,684,0.05
nic,2/11/2022,enjuague crest scope outlast mint ,275,1.0
nic,2/11/2022,galleta pozuelo chiky fresa ,63,0.48
nic,2/11/2022,consome gallina maggi mi sazon ,13,0.04
nic,2/11/2022,empanizador los patitos de pollo ,25,0.1
nic,2/11/2022,hoja de laurel sol maya bolsa ,48,0.03
nic,2/11/2022,salsa lizano picante chilera ,44,0.16
nic,2/11/2022,galleta chiky wafer ,61,0.21
nic,2/11/2022,vinagre gourmet blanco ,78,3.78
nic,2/11/2022,especias sasson pimienta negra ,50,0.06
nic,2/11/2022, pack pimienta negra favora polvo  .gr,19,0.0
nic,2/11/2022,achiote sabemas molido ,10,0.02
nic,2/11/2022,paleta coronado de cajeta tira   unidades ,39,0.01
nic,2/11/2022,crema de avellanaseat value,140,0.35
nic,2/11/2022,boquitas diana de maiz y barbacoa,27,0.2
nic,2/11/2022,snack taquerito yummies chile toreado ,35,0.18
nic,2/11/2022,gelatina sabemas disney fresa bolsa ,12,0.04
nic,2/11/2022,maizgreat valuegrano entero ,42,0.43
nic,2/11/2022,maiz sabemas para palomita bolsa ,37,0.4
nic,2/11/2022,consome res maggi x,13,0.01
nic,2/11/2022,acondicionador elvive coco ,147,0.4
nic,2/11/2022,garnier shampoo fructis hair food aloe ,250,0.3
nic,2/11/2022,jabon barra dove cuida y protege,60,0.14
nic,2/11/2022,jabon toc solenti antib y orig u g,63,0.44
nic,2/11/2022,equate  pack cepillos avengers,43,
nic,2/11/2022,shampoo tio nacho ultra hidratante,205,0.42
nic,2/11/2022,gel de cabello equate ,63,0.9
nic,2/11/2022,protector diario saba confort con alas   unidades,62,
nic,2/11/2022,shampoo head & shoulders old spice para hombres,51,0.09
nic,2/11/2022,elvive óleo extraordinario coco crema para peinar ,155,0.3
nic,2/11/2022,toalla saba buenas noches ex cn alas u,82,
nic,2/11/2022,shampoo herbal essenc en prolong,118,0.3
nic,2/11/2022,crema peinar head shoulders coco,141,0.3
nic,2/11/2022,cepillo dent ora stages  a  anos,82,
nic,2/11/2022,acondicionador tio nacho engrosador ,205,0.42
nic,2/11/2022,acondic tio nacho ultrahidrat coco,205,0.42
nic,2/11/2022, pack jabon rexona antibacterial bamboo ,61,0.36
nic,2/11/2022,jabon liq solenti bio rejuvenecer,55,0.22
nic,2/11/2022,cebada el caracol ,36,0.4
nic,2/11/2022,frijoles la costeña charro lata ,67,0.56
nic,2/11/2022,harina jinca foods de arroz ,56,0.45
nic,2/11/2022,picadillos de cebolla mama gollita ,81,0.45
nic,2/11/2022,gelatina royal uva ,14,0.04
nic,2/11/2022,pasta roma mediana pluma tricolor ,41,0.25
nic,2/11/2022,chao mein cantonesa ,16,0.12
nic,2/11/2022,chimichurri secret d mama jalapeno,134,0.25
nic,2/11/2022,snack tosh tomate parmesano g,105,0.16
nic,2/11/2022,ketchup issima salsa de tomate ,32,0.4
nic,2/11/2022,pringles orginal g,22,0.02
nic,2/11/2022,salsa tomate sabemas tipo ranchera ,11,0.11
nic,2/11/2022,gomitas panditas ricolino clasicos ,37,0.12
nic,2/11/2022,protectores diarios kotex manzanilla unidades,29,
nic,2/11/2022,desodor nivea rollon fem aclar nat,65,0.05
nic,2/11/2022,toalla saba buenas noches extra larga,141,
nic,2/11/2022,jabon neutroskin natural care ,76,0.33
nic,2/11/2022,he bio renew cc manuka honey,227,0.3
nic,2/11/2022,crema peinar elvive reparac total,155,0.3
nic,2/11/2022,toalla saba confort nocturna manzani u,64,
nic,2/11/2022,desodorante spray old spice mar profundo ,109,0.15
nic,2/11/2022,toalla sanitaria saba ultradelg c ala ,51,
nic,2/11/2022,desodorante dove spray men clean comfort ,96,0.15
nic,2/11/2022,shampoo dove nutricion oleo micelar ,162,0.4
nic,2/11/2022,máquinas para afeitar desechables gillette prestobarba body sense  unidades,254,
nic,2/11/2022,acondic herbal essences prolongalo,120,0.3
nic,2/11/2022,crema anti manchas loreal dermo hy,295,0.05
nic,2/11/2022,cepillo dent equate gusanito mas estuche,39,
nic,2/11/2022,gel afeitar nivea sensible for men,380,0.2
nic,2/11/2022,extra max rasuradora triple hoja ea,12,
nic,2/11/2022,crema marlen lamur corporal vainilla ,128,1.0
nic,2/11/2022,vinagre don julio condimentado ,34,0.48
nic,2/11/2022,chocolate nucita patitas nutresa ,14,0.02
nic,2/11/2022,salsa sabemas de tomate ,149,4.0
nic,2/11/2022,curcuma sol maya ,114,0.1
nic,2/11/2022,naturas salsa tomate con queso ,18,0.11
nic,2/11/2022,pasta sabemas canelon ,26,0.2
nic,2/11/2022,galleta marinela dulce maria tubo ,21,0.14
nic,2/11/2022,harina maiz maseca con especias ,37,0.45
nic,2/11/2022,botonetas best chocolate  bolsitas ,50,0.16
nic,2/11/2022,condimento badia sazon completo ,231,0.34
nic,2/11/2022,semilla marañon sol maya ,101,0.08
nic,2/11/2022,dip lactolac cebolla y finas hierbas ,65,0.23
nic,2/11/2022,consome camaron maggi ,13,0.04
nic,2/11/2022,harina maiz pan precoc blanco ,194,1.0
nic,2/11/2022,sardina sabemas en salsa tomate ,33,0.16
nic,2/11/2022,manieat value con miel ,100,0.45
nic,2/11/2022,hoja de laurel sol maya molido,19,0.01
nic,2/11/2022,crema dove nutricion intensiva ,220,0.4
nic,2/11/2022,desodorante rexona men clinical expert aerosol xg,94,0.09
nic,2/11/2022,saba toa s alas ,36,
nic,2/11/2022,shampoo head shoulders manza fresh,216,0.38
nic,2/11/2022,repuesto rasuradora equate e max   unidades,190,
nic,2/11/2022, pack cepillo equate xtreme care,79,
nic,2/11/2022,elvive dream long liss crema de peinar,147,0.3
nic,2/11/2022,rasuradora equate mango goma dama u,148,
nic,2/11/2022,crema nivea cuidado efecto mate  ,82,0.05
nic,2/11/2022,bifasico loreal dermo exp hyd to ,249,0.12
nic,2/11/2022,shampoo pantene prov restauración ,51,0.1
nic,2/11/2022,crema nivea lata,36,0.02
nic,2/11/2022,conair plancha ceramica tratam ac argan,600,
nic,2/11/2022,shampoo palmolive naturals control caspa citrus  en   ,113,0.75
nic,2/11/2022,desodorante speed stick / xtreme intense barra  g,61,0.05
nic,2/11/2022,shampoo palmolive optims reparación completa  + acondicionador ,179,0.4
nic,2/11/2022, packcepillo dental colgate ° advanced luminous white,137,
nic,2/11/2022,crema lubriderm extrahumentante,330,0.4
nic,2/11/2022,harina de maiz sabemas ,33,0.91
nic,2/11/2022,gourmet mayonesa reducia en lpidos,87,0.88
nic,2/11/2022,salsa don julio picante chile rojo ,64,0.46
nic,2/11/2022,galleta bridge naranja colombina ,41,0.3
nic,2/11/2022,barra brander de ajonjoli krunchy ,62,0.18
nic,2/11/2022,palomitas act ii mantequilla ,48,0.09
nic,2/11/2022,great value salsa marinara ,79,0.68
nic,2/11/2022,sopa gv vaso sabor pollo,18,0.06
nic,2/11/2022,chocolate nucita nutresa trisabor dispenz ,45,0.14
nic,2/11/2022,sopa pollo con letras maggi ,12,0.06
nic,2/11/2022,salsa del monte sabor a queso ,51,0.4
nic,2/11/2022,vegetaleseat value guisante zanahoria ,40,0.23
nic,2/11/2022,papaseat value tubo queso ,64,0.16
nic,2/11/2022,crema cola res maggi ,19,0.08
nic,2/11/2022,sopa nissin instantanea de camaron picante vaso ,20,0.06
nic,2/11/2022,sopa nissin instantanea de mariscos vaso ,20,0.06
nic,2/11/2022,paleta colombina tipitin besos ,51,0.29
nic,2/11/2022,tinte igora brillanc  rub cenizo,219,0.05
nic,2/11/2022,máquinas para afeitar desechables gillette prestobarba ultragrip   unidades,142,
nic,2/11/2022,desodorante dove barra invisible dry men ,69,0.05
nic,2/11/2022,eq set de viaje rb  botellas bols ea,56,
nic,2/11/2022,set rosario bendek antifaz tapones y almohada,125,
nic,2/11/2022,shower nivea men gel active clean ,182,0.5
nic,2/11/2022,shampoo savile argan ,100,0.55
nic,2/11/2022,desodorante axe excite stick barra ,71,0.05
nic,2/11/2022,shampoo savile bio,100,0.55
nic,2/11/2022,crema corporal nivea soft milk,222,0.22
nic,2/11/2022,rb pack tag para viaje simulacion cuero,75,
nic,2/11/2022,shampoo tresemme infusion keratina ,161,0.4
nic,2/11/2022,shampoo activee keratin profesiona,195,0.47
nic,2/11/2022,jabón líquido asepxia carbón detox,190,0.2
nic,2/11/2022,shampoo pantene prov rizos definidos ,187,0.4
nic,2/11/2022,shamp john frid friz beyon smooth,313,0.25
nic,2/11/2022,máquina de afeitar gillette venus original   unidad,147,
nic,2/11/2022,tratam nevada argan oil repara,290,1.0
nic,2/11/2022,empanizador sabemas ,25,0.06
nic,2/11/2022,ajo listo don julio ,94,0.33
nic,2/11/2022,barra de cereal tosh lyne fresa g u,119,0.17
nic,2/11/2022,salsa del monte tomate tradicional ,51,0.4
nic,2/11/2022,empanizador don julio ,51,0.14
nic,2/11/2022,sopa nissin instantanea de camaron vaso ,20,0.06
nic,2/11/2022,salsa mexicana herdez verde picante bot,77,0.45
nic,2/11/2022,paleta colombina bon bon bum fresa ,60,0.41
nic,2/11/2022,aderezo campestre italiano ,45,0.2
nic,2/11/2022,mayonesa mccormick doy pack ,176,1.0
nic,2/11/2022,ajo en trozos maggi de la huerta frasco g,63,0.08
nic,2/11/2022,consome res maggi ,42,0.01
nic,2/11/2022,sopa gv vaso sabor carne,18,0.06
nic,2/11/2022,canela molida sol maya ,71,0.07
nic,2/11/2022,papas pringles queso ,92,0.12
nic,2/11/2022, packeat value palomita microonda extmantequilla ,77,0.08
nic,2/11/2022,barra bimbo multigrano nuez ,77,0.2
nic,2/11/2022,mermelada sabemas piña bolsa ,35,0.3
nic,2/11/2022,rasuradora bic comfort  unidad,15,
nic,2/11/2022,acondicionador sedal ceramidas,111,0.34
nic,2/11/2022,desodor rexona barra clinical fresh,123,0.05
nic,2/11/2022,rasuradora gillette ultra pag  llev u,285,
nic,2/11/2022,crema teatrical facial antiarrugas,96,0.2
nic,2/11/2022,rasuradora bic shaver sensible bolsa  unidades,42,
nic,2/11/2022,rasuradora bic doble hoja mujer unidades,50,
nic,2/11/2022,perry ellis body splash  clasic,390,0.24
nic,2/11/2022,acondicionador pantene prov rizos definidos ,181,0.4
nic,2/11/2022,crema bellestrate alizadora rojo,190,0.1
nic,2/11/2022,nuvel crema coco mas  porciento,74,0.62
nic,2/11/2022,crema nivea body reafirmante q,324,0.25
nic,2/11/2022,gorro cholesterol lqqks   unidad,59,
nic,2/11/2022,desodorante nivea rollon silver men ,65,0.05
nic,2/11/2022,gel xtreme professional envase ,66,0.5
nic,2/11/2022,algodîn torunda jaloma de  bolitas,40,
nic,2/11/2022,deo axe barra antitransp collision,71,0.05
nic,2/11/2022,fecula maizena de maiz original ,32,0.19
nic,2/11/2022,fecula maizena de maiz vainilla ,16,0.05
nic,2/11/2022,harina premiun trigo ,47,1.36
nic,2/11/2022,aceite wesson canola ,217,0.71
nic,2/11/2022,miel de abeja bee nica pura,310,1.0
nic,2/11/2022,pasta ina linguini ,14,0.2
nic,2/11/2022,frijol goya negro entero premium ,167,0.82
nic,2/11/2022,pinol el caracol,32,0.4
nic,2/11/2022,avena el caracol molida ,37,0.45
nic,2/11/2022,mini gelatina  siete de frutas,30,0.31
nic,2/11/2022,gomitas pino frutas diana ,25,0.12
nic,2/11/2022,aceite ideal soya omega y ,357,3.75
nic,2/11/2022,dulces diana caramelo de leche ,46,0.15
nic,2/11/2022,garbanzo herdez lata,58,0.4
nic,2/11/2022,mermelada helios arandanos extra,77,0.34
nic,2/11/2022,paletas colombina tipitin cervecita ,52,0.29
nic,2/11/2022,creme nivea men multiuso l,97,
nic,2/11/2022, pack desodorante rexona aerosol ap v men ,142,0.18
nic,2/11/2022,tinte koleston wel castaño mediano   unidad,158,
nic,2/11/2022,desodor dove barra aclarado perfect,69,0.05
nic,2/11/2022,gel para cabello,142,
nic,2/11/2022,ttaio relax guant para bano tela stretch,34,
nic,2/11/2022,body splash jacquidavid forever,255,0.24
nic,2/11/2022,body splash jacquidavid pass love,255,0.24
nic,2/11/2022,desodorante nivea barra dama black white ,95,0.05
nic,2/11/2022,gel fijador xtreme lady g,53,0.26
nic,2/11/2022,desodorante nivea barra men silver protection ,95,0.05
nic,2/11/2022,desodorante nivea barra men black white ,95,0.05
nic,2/11/2022,tela after spa strech,49,
nic,2/11/2022,gel fijador ego power ,142,1.0
nic,2/11/2022,locionisi dese kid berinaiz ,102,0.25
nic,2/11/2022,desodorante dove roll on,63,0.05
nic,2/11/2022,desodorante rexona women clinical extra dry ,123,0.05
nic,2/11/2022,acondic fructis oil repair,122,0.35
nic,2/11/2022,cereal kellogrgr's® zucaritas® sabor chocolate con malvaviscos  hojuelas de maíz escarchadas con sabor a chocolate y con malvaviscos   caja de g,105,0.26
nic,2/11/2022,aceite clover de girasol ,549,4.73
nic,2/11/2022,lasagna sabemas caja,57,0.3
nic,2/11/2022,sopa gv bolsa sabor pollo,10,0.08
nic,2/11/2022,arroz nicoya   libras,438,
nic,2/11/2022,chocolate hersheys kisses ,97,0.13
nic,2/11/2022,salsa preparada naturas italiana clasica ,18,0.11
nic,2/11/2022,tallarin sabemas precocido ,26,0.2
nic,2/11/2022,polvoeat value de hornear ,40,0.23
nic,2/11/2022,crema cicatricure contorno de ojos  .gr,328,0.0
nic,2/11/2022,hidratante nivea matificante fps,405,0.05
nic,2/11/2022,toalla ponds desmaquillan sensitive   unidades,100,
nic,2/11/2022,spray loreal magic retouch clor rub,249,0.08
nic,2/11/2022,desodorante rexona mujer spray clinical clinical expert,60,0.15
nic,2/11/2022,cream equate dry skin moisturizing,60,0.45
nic,2/11/2022,agua micelar asepxia carbon,255,0.4
nic,2/11/2022,acondiconador dove oleo micelar,80,0.4
nic,2/11/2022,l'oreal magic retouch castaño claro,249,
nic,2/11/2022,ganchos equate para el cabello und,20,
nic,2/11/2022,gel tatto maybelline cejas brown tint un  medium   unidad,660,
nic,2/11/2022,chocolate hersheys gigante almendra ,175,0.19
nic,2/11/2022,dulce venus candy mix bolsa ,165,1.36
nic,2/11/2022,arroz vigo paella valenciana ,279,0.54
nic,2/11/2022,fragata aceite de orujo de oliva,499,2.0
nic,2/11/2022,ducal frijol molido picante medio,44,0.4
nic,2/11/2022,sucralosaeat valueanulada ,135,0.28
nic,2/11/2022,flan sabemas vainilla con caramelo ,18,0.06
nic,2/11/2022,paleta colombina tipitin surtido sabores ,35,0.18
nic,2/11/2022,galleta pozuelo soda integral paquete  unidades ,31,0.18
nic,2/11/2022,mostaza mccormick frasco ,83,0.43
nic,2/11/2022,nestle fitness® frutas cereal g caja,144,0.35
nic,2/11/2022,vino tinto de cocinar la vi§a .oz,181,
nic,2/11/2022,atun suli trocitos en aceite ,41,0.14
nic,2/11/2022,endulzanteeat value sin calorias ,99,0.2
nic,2/11/2022,aderezoeat value ranch light l,71,0.47
nic,2/11/2022,pringles wavi jalapena  g,104,0.14
nic,2/11/2022,chocolate gallito milán  unidades  .,45,0.01
nic,2/11/2022,tinte igora vital cafe moc clar,188,0.14
nic,2/11/2022,máquina para afeitar recargable gillette styler en  unidad,1,
nic,2/11/2022,rasuradora bic comfort  black night bu,71,
nic,2/11/2022,cepillo equate de madera u,110,
nic,2/11/2022,hair food acondicionador aguacate ,250,0.3
nic,2/11/2022,borla para baño ttaio textura rigida   unidad,30,
nic,2/11/2022,desodorante dove spray go fresh pep te ,96,0.15
nic,2/11/2022,rasuradora para mujer equate h  pza,48,
nic,2/11/2022,acondicionador herbal essences moring oil ,294,0.4
nic,2/11/2022,desodorante rexona spray motions invisible antbacterial,83,0.15
nic,2/11/2022,head & shoulders relax control comezón con eucalipto shampoo control caspa,295,0.7
nic,2/11/2022,jabón líquido para manos lysol skin care doypack ,81,0.22
nic,2/11/2022,he bio renew shampoo golden mori,303,0.4
nic,2/11/2022,exprimidor equate p pasta de dientes u,8,
nic,2/11/2022,equate cepillo redondo,40,
nic,2/11/2022,crema equate hidratante diario,90,0.47
nic,2/11/2022,salsaeat value espesa picante medio ,95,0.68
nic,2/11/2022,te canela manzate caja  unidades  .gr,88,0.0
nic,2/11/2022,avena sabemas integral ,81,1.0
nic,2/11/2022,aceite ambar de soya  .lt,329,
nic,2/11/2022,marshmelloweat value sabor vainilla ,50,0.28
nic,2/11/2022, pack galleta principe fresa ,67,0.34
nic,2/11/2022,aceite colavita de oliva,255,1.0
nic,2/11/2022,aderezogreat value cesar ,71,0.47
nic,2/11/2022,la coste§a ensalada campesina x,34,0.22
nic,2/11/2022,harina espiga dorada todo uso ,67,2.27
nic,2/11/2022,barraeat valueanola masticable mani salado y dulce ,103,0.21
nic,2/11/2022,salsa biibii bbq con miel y chile ,131,0.3
nic,2/11/2022,curcuma sol maya sobre ,20,0.01
nic,2/11/2022,especie badia sazon completa  .gr,52,0.01
nic,2/11/2022,cereal nestle crunch caja ,143,0.33
nic,2/11/2022,salsa picante habanero chilango ,77,0.15
nic,2/11/2022,pimienta negra molida sol maya ,58,0.03
nic,2/11/2022,boquitas frito lay doritos nachos ,38,0.15
nic,2/11/2022,cepillo oral b ultrafino pack,155,
nic,2/11/2022,jabón líquido antibacterial protex avena ,68,0.22
nic,2/11/2022,pack colgate smiles pasta dental  + cepillo batman/wonder woman,132,0.08
nic,2/11/2022,rasuradora para hombre equate h  pza,68,
nic,2/11/2022,pasta dental colgate smiles justice league ,44,0.06
nic,2/11/2022,spray corporal antibacterial protex duo protect ,134,0.18
nic,2/11/2022, pack cepillo dental colgate encías therapy,147,
nic,2/11/2022,kit remington cortadora cuidado personal,1,
nic,2/11/2022,shampoo herbal essences con aloe y sea ke,284,0.25
nic,2/11/2022,enjuague bucal colgate plax ice glacial  + ,300,0.5
nic,2/11/2022,desodorante lady speed stick / powder fresh barra  g,58,0.04
nic,2/11/2022, pack cepillo dental colgate colors,123,
nic,2/11/2022,pasta dental colgate luminous white brilliant mint ,131,0.17
nic,2/11/2022,desodorante lady speed stick derma + aclarado perla aerosol   g,49,0.06
nic,2/11/2022,consome de pollo favora frasco ,97,0.45
nic,2/11/2022,galleta taifelds amaranto arandano avena nueces chia miel abeja ,272,0.6
nic,2/11/2022,paprikaeat value molida ,190,0.45
nic,2/11/2022,consome gallina maggi sabor y color x,13,0.01
nic,2/11/2022,marshmellow sabemas vainilla ,54,0.26
nic,2/11/2022,boquita yummies chicharron picante ,62,0.1
nic,2/11/2022,sazon con azafran goya caja de . oz,126,
nic,2/11/2022,boquitas jacks meneitos clasicos ,56,0.12
nic,2/11/2022,melocotongreat value en mitades ,110,0.82
nic,2/11/2022,cereal suli aros de frutas ,121,0.9
nic,2/11/2022,bebida quaker frescavena de fresa ,47,0.33
nic,2/11/2022,mermelada sabemas de mora bolsa ,34,0.3
nic,2/11/2022,barra nature valley crujiente avena y miel ,140,0.25
nic,2/11/2022,boquitas frito lay sour cream ,145,0.18
nic,2/11/2022,sazonador para cerdo maggi de la huerta frasco g,72,0.09
nic,2/11/2022,cajeta de coco negro el carmen  .gr,32,0.08
nic,2/11/2022,frijol ducal molido rojo picante medio,78,0.79
nic,2/11/2022,sal de ajo maggi de la huerta frasco g,63,0.11
nic,2/11/2022,enjuague bucal colgate total clean mint  ,289,0.5
nic,2/11/2022, pack cepillo dental colgate ° antibacterial,130,
nic,2/11/2022, pack jabón de tocador palmolive naturals sensación humectante oliva y aloe  g,60,0.1
nic,2/11/2022, pack cepillo dental colgate slim soft,110,
nic,2/11/2022,tinte igora vital  rubio,195,0.05
nic,2/11/2022, pack cepillo dental colgate pro cuidado,125,
nic,2/11/2022,cepillo dental colgate smiles barbie/batman + años,68,
nic,2/11/2022,rasuradora p mujer equate e max  pza,230,
nic,2/11/2022,desodorante lady speed stick orchard blossom barra  g,58,0.04
nic,2/11/2022,concealer maybelline age rewind  golde   unidad,617,0.14
nic,2/11/2022,sahmpoo herbal essences con aloe y sea ke,284,0.4
nic,2/11/2022,crema marlen lamur corporal familiar ,128,1.0
nic,2/11/2022,desodorante gillette barra clear gel sport g,134,0.08
nic,2/11/2022,gomitas ricolino panditas acidos ,37,0.12
nic,2/11/2022,boquitas cantonesa platano ,25,0.09
