country,date,name,price,weight
nic,1/14/2022,frijol sabemas rojo ,97,1.82
nic,1/14/2022,azucar golden brown morena ,74,2.0
nic,1/14/2022,arroz el faisan  ,99,2.0
nic,1/14/2022,azucar mote rosa sulfitada ,59,2.0
nic,1/14/2022,galleta nabisco oreo regular ,75,0.43
nic,1/14/2022,sal sol refinada yodada bolsa ,15,0.5
nic,1/14/2022,galleta club social integral ,38,0.23
nic,1/14/2022,galleta pozuelo maria  unidades ,52,0.25
nic,1/14/2022,sopa pollo con fideos maggi ,12,0.06
nic,1/14/2022,naturas salsa tomate ketchup dp,34,0.38
nic,1/14/2022,sal atlantidauesa molida y seca,7,0.45
nic,1/14/2022,azucar san antonio refinada ,74,2.0
nic,1/14/2022,harina de maiz maseca bolsa ,100,2.27
nic,1/14/2022,arroz carolinaano entero,83,2.0
nic,1/14/2022,avena sasa molida ,30,0.4
nic,1/14/2022,vinagre sabemas claro ,19,0.7
nic,1/14/2022,maizeat value lata  .oz ,35,0.25
nic,1/14/2022,avena sabemas en hojuelas ,59,1.0
nic,1/14/2022,arroz / el faisan ,329,6.8
nic,1/14/2022,arroz faisan ,449,11.34
nic,1/14/2022,pasta naturas de tomate tradicional ,37,0.21
nic,1/14/2022,cafe selecto molido superior ,131,0.4
nic,1/14/2022,pinolillo sabemas ,21,0.4
nic,1/14/2022,arroz tio pelonano entero  ,71,2.0
nic,1/14/2022,galleta de maiz sanissimo salmas ,58,0.14
nic,1/14/2022,frijol sabemasano rojo ,47,0.9
nic,1/14/2022,miel aunt jemma original pancake ,71,0.36
nic,1/14/2022,aceiteeat value oliva extra virgen ,162,0.75
nic,1/14/2022,mezclaeat value panqueques original ,88,0.91
nic,1/14/2022,,21,
nic,1/14/2022,sopa criolla gallina con fideo maggi ,12,0.06
nic,1/14/2022,azucar monte rosa sulfitada ,296,10.0
nic,1/14/2022,mostaza hellmanns doy pack ,23,0.2
nic,1/14/2022,galleta pozuelo recreo bolsa ,67,0.38
nic,1/14/2022,avena sasa en hojuela ,22,0.3
nic,1/14/2022,jalea callejas de guayaba ,27,0.1
nic,1/14/2022,cafâ toro,14,0.11
nic,1/14/2022,mostazaeat value,38,0.4
nic,1/14/2022,tajadas laanja de platano ,67,0.3
nic,1/14/2022,cubito pollo maggi abre facil ,24,0.1
nic,1/14/2022,harina de maiz del comal ,39,0.91
nic,1/14/2022,frijol suli rojo ,93,1.82
nic,1/14/2022,arroz suli aanel  ,16,0.45
nic,1/14/2022,frijol sabemasanel rojo  ,22,0.45
nic,1/14/2022,atún gaviota lomo trozos en agua ,49,0.1
nic,1/14/2022,salsa kern's tomte ketchup doy pack ,35,0.4
nic,1/14/2022,cafe molido segovia puro regular ,105,0.4
nic,1/14/2022,pasta roma plumas ,21,0.2
nic,1/14/2022,aceituna rellenas c/ piemiento manz g,50,0.2
nic,1/14/2022,harina suli para pancake ,41,0.45
nic,1/14/2022,te gv de manzanilla ,22,0.02
nic,1/14/2022,arroz tio pelonano entero / ,91,2.0
nic,1/14/2022,petit pois herdez en lata ,46,0.21
nic,1/14/2022,boquitas diana churritos sabr queso,26,0.1
nic,1/14/2022,tortilla diana de maiz jalapeños ,26,0.16
nic,1/14/2022,salsa inglesa mccormick ,82,0.3
nic,1/14/2022,ketchup kern's botella plastico ,80,0.78
nic,1/14/2022,vegetales mixtos herdez lata,47,0.4
nic,1/14/2022,maiz dulce herdez lata,40,0.22
nic,1/14/2022,galleta pozuelo tipo   unidades,48,0.3
nic,1/14/2022,aceite rico vegetal ,381,5.0
nic,1/14/2022,crema hongos maggi ,17,0.06
nic,1/14/2022,cerealeat value crispy rice,150,0.55
nic,1/14/2022,pasta roma de coditos ,21,0.2
nic,1/14/2022,salsaeat value tomate ketchup ,169,1.81
nic,1/14/2022,ajo sabemas en polvo bolsa ,8,0.02
nic,1/14/2022,galleta ritz queso ,81,0.41
nic,1/14/2022,consome pollo maggi sabor y color tira x,42,0.01
nic,1/14/2022, pack atun suli trocitos en aceite ,112,0.4
nic,1/14/2022,coffee mate original sin lactosa sustituto de crema en polvo tarro g,140,0.65
nic,1/14/2022,aceiteeat value oliva puro ,200,0.75
nic,1/14/2022,nestle corn flakes sin gluten cereal bolsa g,173,0.8
nic,1/14/2022,papitas yummies estilo clasico,39,0.08
nic,1/14/2022,frijol blanditos rojo refrito ,36,0.45
nic,1/14/2022,galleta pozuelo soda integral paquete  unidades ,31,0.18
nic,1/14/2022,vinagregreat value sidra manzana ,59,0.95
nic,1/14/2022,harina maiz pan precoc blanco ,194,1.0
nic,1/14/2022,boquitas de yucas tostadas hores,67,0.22
nic,1/14/2022,galleta suli salada  unidades ,25,0.19
nic,1/14/2022,avena sabemas integral ,81,1.0
nic,1/14/2022,salsa sabemas de tomate ,149,4.0
nic,1/14/2022,mayonesa alolivo con aceite de oliva ,91,0.4
nic,1/14/2022,boquita yummies chicharron picante ,53,0.1
nic,1/14/2022,galleta chiky wafer ,61,0.21
nic,1/14/2022,mayonesa mccormick doy pack ,176,1.0
nic,1/14/2022,gelatina royal fresa ,14,0.04
nic,1/14/2022,fecula maizena de maiz vainilla ,16,0.05
nic,1/14/2022,gelatina royal uva ,27,0.08
nic,1/14/2022,mayonesa hellmanns pura doy pack ,74,0.4
nic,1/14/2022,pasta roma tornillos ,21,0.2
nic,1/14/2022,galleta nabisco ritz  .gr,57,0.01
nic,1/14/2022,boquitas milpa real tostadas ,73,0.36
nic,1/14/2022,azucar sulfitadaanel  ,14,49.9
nic,1/14/2022,aceite ideal soya ,147,1.5
nic,1/14/2022,aceituna manzanilla sin hueso x,46,0.2
nic,1/14/2022,salsa lizano de vegetales criolla ,54,0.28
nic,1/14/2022,sopa criolla costilla res maggi ,12,0.06
nic,1/14/2022,arroz sabemas   saco de ,403,10.0
nic,1/14/2022,galleta pozuelo crema rellena vainilla ,46,0.38
nic,1/14/2022,tortilla milpa real ,38,0.18
nic,1/14/2022, pack papas pringles muelitas original ,196,0.23
nic,1/14/2022,galleta marinela sponch fresa ,58,0.36
nic,1/14/2022,galleta sanissimo chia linaza g,58,0.14
nic,1/14/2022,pasta anita spaghetti ,13,0.2
nic,1/14/2022,avena quaker molida ,30,0.28
nic,1/14/2022,lentejas goya ,109,0.4
nic,1/14/2022,arroz / carolina ,191,4.0
nic,1/14/2022,te manzanilla manzate caja  unidades ,165,0.12
nic,1/14/2022,pasta naturas tomate tradicional ,18,0.11
nic,1/14/2022,cafe casa del cafe molido house blend ,183,0.45
nic,1/14/2022,pasta anita caracolito ,12,0.17
nic,1/14/2022,aceite clover de soya ,200,2.0
nic,1/14/2022,salsa lizano regular doypack ,46,0.4
nic,1/14/2022,papitas lays original  oz,23,
nic,1/14/2022,vinagre blanco mama gollita,26,0.7
nic,1/14/2022,galleta pozuelo chiky chips ,69,0.24
nic,1/14/2022,canela molida sol maya ,71,0.07
nic,1/14/2022,snackeat value crema y cebolla ,94,0.22
nic,1/14/2022,pasta macarron roma ,26,0.25
nic,1/14/2022,cafe selecto molido clasico ,106,0.4
nic,1/14/2022,gelatina royal frambuesa ,27,0.08
nic,1/14/2022,gomitas panditas ricolino clasicos ,40,0.12
nic,1/14/2022, packeat value pasas de uva ,70,0.03
nic,1/14/2022,cafe dipilto molido gourmet ,150,0.4
nic,1/14/2022,paleta colombina tipitin surtido sabores ,35,0.18
nic,1/14/2022,palomitaeat value microo extramantequilla ,28,0.08
nic,1/14/2022,sopa nissin instantanea de camaron picante vaso ,20,0.06
nic,1/14/2022,miel suli de abeja botella squeeze ,103,0.5
nic,1/14/2022,leche burra el carmen bolsa ,25,0.23
nic,1/14/2022,fecula maizena original de maiz ,62,0.38
nic,1/14/2022,cereal quinoa goya organica ,302,0.34
nic,1/14/2022,frijoles la costeña charro lata ,67,0.56
nic,1/14/2022,hongos richly troceados ,89,0.42
nic,1/14/2022,pasta roma pequeña mini plumas ,26,0.25
nic,1/14/2022,edulcorante splenda cajas ,381,0.2
nic,1/14/2022,dip lactolac queso cheddar ,62,0.23
nic,1/14/2022,salsita naturas de tomate ranchera ,18,0.11
nic,1/14/2022,galleta pozuelo dul mantequilla ,64,0.31
nic,1/14/2022,tomateseat value trozos con ajo ,50,0.41
nic,1/14/2022,consome de pollo favora frasco ,89,0.45
nic,1/14/2022,paleta colombina bon bon bum fresa ,60,0.41
nic,1/14/2022,confite gallito morenito  ,40,0.21
nic,1/14/2022,sal de ajo maggi de la huerta frasco g,63,0.11
nic,1/14/2022, pack pimienta negra favora polvo  .gr,18,0.0
nic,1/14/2022,boquitas frito lay sour cream ,128,0.18
nic,1/14/2022,endulzanteeat value stevia  sobres ,125,0.16
nic,1/14/2022,fecula maizena de maiz original ,32,0.19
nic,1/14/2022,cafe las flores enano tuest med,380,0.91
nic,1/14/2022,azucar sol maya glass ,47,0.2
nic,1/14/2022,granola alin pasas bolsa ,45,0.25
nic,1/14/2022,aceite clover de girasol ,501,4.73
nic,1/14/2022,mania nuts con pasas ,23,0.05
nic,1/14/2022,polvoeat value de hornear ,40,0.23
nic,1/14/2022,coctel frutaeat value extra light ,70,0.42
nic,1/14/2022,aderezo regia alolivo ranch ,81,0.24
nic,1/14/2022,atun suli trocitos en agua ,63,0.3
nic,1/14/2022,jarabe suli de maple ,45,0.34
nic,1/14/2022,harina maseca enchilada c consume ,37,0.45
nic,1/14/2022,galleta pozuelo salada club extra ,31,0.22
nic,1/14/2022,consome costilla res maggi x,13,0.01
nic,1/14/2022,vinagre sabemas oscuro botella ,21,0.7
nic,1/14/2022,harina maseca de maiz  .gr,42,0.02
nic,1/14/2022,arroz sabemas   saco ,476,10.0
nic,1/14/2022,aceite canolaeat value spray ,82,0.23
nic,1/14/2022,galleta del carmen avena chocolate ,68,0.26
nic,1/14/2022,galleta pozuelo soda salada caja ,66,0.44
nic,1/14/2022,boquita yummies zambos chile limon ,43,0.14
nic,1/14/2022,ajo sabemas en polvo frasco ,42,0.08
nic,1/14/2022,galleta pozuelo soda especias naturales paquete  unidades ,31,0.18
nic,1/14/2022,boquitas yummies ranchitas natural ,43,0.3
nic,1/14/2022,azucar san antonio regular,298,10.0
nic,1/14/2022,arroz carolinaano entero / ,16,0.4
nic,1/14/2022,pasta roma caracolito ,18,0.2
nic,1/14/2022,manieat value sin sal ,93,0.45
nic,1/14/2022,nestle cheerios® + nesquik® + trix®. cereal  pack g,135,0.53
nic,1/14/2022,salsa ketchup gourmet doy pack ,50,0.8
nic,1/14/2022,crema dulce dos pinos  ,47,0.25
nic,1/14/2022, pack atun suli trocitos en aceite con vegetales  g,119,0.56
nic,1/14/2022,pasta sabemas tornillo twists ,15,0.25
nic,1/14/2022,atun suli trocitos con vegetales ,59,0.3
nic,1/14/2022,sopa pollo con fideos libre de gluten maggi ,14,0.06
nic,1/14/2022,ajoeat value picado en aceite ,69,0.23
nic,1/14/2022,achiote molido sol maya ,74,0.2
nic,1/14/2022,te jengibre limon miel manzate caja  unidades ,83,0.03
nic,1/14/2022,galleta tosh pozuelo limon te verde  .gr,90,0.0
nic,1/14/2022, pack papas pringles crema y cebolla ,196,0.25
nic,1/14/2022,salsa naturas ketchup ,55,0.89
nic,1/14/2022,harina maiz el comal ,181,4.55
nic,1/14/2022,especie sabemas pimienta y comino en polvo  ,8,0.02
nic,1/14/2022,sal sol dorada en bote ,29,0.5
nic,1/14/2022,galleta sabemas dulce mantequilla ,53,0.31
nic,1/14/2022,sazonador naturisimo maggi ,69,0.22
nic,1/14/2022,pasta sabemas lengua,13,0.2
nic,1/14/2022,barra de cereal tosh lyne pina g u,119,0.17
nic,1/14/2022,frijol rojo entero blanditos ,54,0.91
nic,1/14/2022,pasas bolsa sol maya ,28,0.07
nic,1/14/2022,cafe las flores nuestra tierra mataga ,260,0.91
nic,1/14/2022,melocotoneat value en rodaja % jugo ,115,0.82
nic,1/14/2022,edulzante splenda  sobres ,251,0.1
nic,1/14/2022,salsaeat value espesa picante medio ,95,0.68
nic,1/14/2022,cereal malt o meal marshmallow ,89,0.34
nic,1/14/2022,barra nature valley crujiente avena y miel ,140,0.25
nic,1/14/2022,sazonador naturisimo maggi pack x,14,0.01
nic,1/14/2022,cerealeat value canela crunch ,123,0.57
nic,1/14/2022,mani diana japones hornea sal soya ,18,0.1
nic,1/14/2022,nuez cashitas de marañon horneada ,71,0.07
nic,1/14/2022,mezcla pancake bettycrocker bisquick ,100,0.57
nic,1/14/2022,maiz dulce del monte en crema ,52,0.42
nic,1/14/2022,sardina la sirena ovalada picante,96,0.42
nic,1/14/2022,atun la sirena en agua ,73,0.1
nic,1/14/2022,huevitos mani confiteria american ,32,0.2
nic,1/14/2022,sopa gallina criolla knorr ,10,0.05
nic,1/14/2022,chocolate hersheys milk choc share pack ,285,0.31
nic,1/14/2022,chocolates goplana surtido cuadros,250,0.2
nic,1/14/2022,salsa lizano picante ,27,0.06
nic,1/14/2022,boquita yummies platanos y chicharron ,43,0.15
nic,1/14/2022,sardina sabemas en salsa tomate ,30,0.16
nic,1/14/2022,te jengibre limon mondaisa caja undm,72,0.03
nic,1/14/2022,salsa lizano picante chilera ,44,0.16
nic,1/14/2022,nestle corn flakes sin gluten cereal g caja,101,0.4
nic,1/14/2022,crema tomate maggi ,17,0.08
nic,1/14/2022,flan sabemas vainilla con caramelo ,27,0.13
nic,1/14/2022,cafe san sebastianano oscuro ,140,0.4
nic,1/14/2022,frijol naturas molido rojo ,52,0.4
nic,1/14/2022,chop suey el chinito bolsa ,16,0.11
nic,1/14/2022,aceite ambar de soya ,176,1.89
nic,1/14/2022,cereal kellogrgr's® zucaritas® sabor origrinal  hojuelas de maíz escarchadas con azúcar   caja de,235,0.71
nic,1/14/2022,salsa suli vegetales tipo inglesa,51,0.7
nic,1/14/2022,pasta roma corta cabellos ,37,0.25
nic,1/14/2022,granola naturalez fibra especial ,51,0.28
nic,1/14/2022,sardina sardimar dulce g,33,0.16
nic,1/14/2022,mezcla krusteaz pancake muttermilk ,110,0.91
nic,1/14/2022,miel de abeja miss amalie botella ,110,0.34
nic,1/14/2022,almendraeat value natural,210,0.45
nic,1/14/2022,cafe casa del cafe molido vainilla ,185,0.4
nic,1/14/2022,comino sol maya en polvo ,19,0.01
nic,1/14/2022,vegetaleseat value mixtos ,40,0.42
nic,1/14/2022,consome gallina maggi sabor y color x,13,0.01
nic,1/14/2022,gv galleta limon rellena crema,99,0.71
nic,1/14/2022,salsa china mccormick ,91,0.3
nic,1/14/2022,snack taquerito yummies chile toreado ,35,0.18
nic,1/14/2022,galleta pozuelo tosh coco almendra  .gr,93,0.0
nic,1/14/2022,sopa nissin instantanea pollo vaso ,20,0.06
nic,1/14/2022,paleta ricolino payaso malvav mini,15,0.02
nic,1/14/2022,endulzanteeat value steviaanulada ,180,0.28
nic,1/14/2022,salsa roma preparada sofrito ,17,0.11
nic,1/14/2022,galleta sabemas maria ,19,0.17
nic,1/14/2022,salsa don julio picante chile rojo ,61,0.46
nic,1/14/2022,oregano badia entero ,52,0.01
nic,1/14/2022,galleta pozuelo chiky fresa ,63,0.48
nic,1/14/2022,cerealeat value aros miel ,137,0.61
nic,1/14/2022,mojo badia marinado,158,0.59
nic,1/14/2022,boquitas yummies nacho con queso ,29,0.15
nic,1/14/2022, pack galleta marinela chocolate ,67,0.34
nic,1/14/2022,mani pro limon sal ,19,0.08
nic,1/14/2022,la coste§a ensalada campesina x,34,0.22
nic,1/14/2022,vinagre goya blanco destilado ,137,0.95
nic,1/14/2022,consome gallina maggi mi sazon ,13,0.04
nic,1/14/2022,consome pollo maggi tira x,42,0.01
nic,1/14/2022,especias sasson pimienta negra ,50,0.06
nic,1/14/2022,cebada sasa instantanea ,31,0.4
nic,1/14/2022,aceite de soya ambar ,74,0.75
nic,1/14/2022,harina jinca foods de arroz ,56,0.45
nic,1/14/2022,sardina sardimar picante  g,33,0.16
nic,1/14/2022,premezcla jinca para pancake gfree,83,0.45
nic,1/14/2022,galleta navidad sams choice lata,98,0.34
nic,1/20/2022,frijol sabemas rojo ,97,1.82
nic,1/20/2022,azucar golden brown morena ,75,2.0
nic,1/20/2022,arroz el faisan  ,99,2.0
nic,1/20/2022,azucar mote rosa sulfitada ,61,2.0
nic,1/20/2022,galleta nabisco oreo regular ,75,0.43
nic,1/20/2022,sal sol refinada yodada bolsa ,15,0.5
nic,1/20/2022,galleta pozuelo maria  unidades ,52,0.25
nic,1/20/2022,galleta club social integral ,38,0.23
nic,1/20/2022,sopa pollo con fideos maggi ,12,0.06
nic,1/20/2022,ketchup kern's botella plastico ,45,0.38
nic,1/20/2022,sal atlantidauesa molida y seca,8,0.45
nic,1/20/2022,harina de maiz maseca bolsa ,100,2.27
nic,1/20/2022,azucar san antonio refinada ,74,2.0
nic,1/20/2022,arroz carolinaano entero,83,2.0
nic,1/20/2022,arroz faisan ,449,11.34
nic,1/20/2022,cafe selecto molido superior ,131,0.4
nic,1/20/2022,avena sabemas en hojuelas ,59,1.0
nic,1/20/2022,maizeat value lata  .oz ,35,0.25
nic,1/20/2022,arroz / el faisan ,329,6.8
nic,1/20/2022,pasta naturas de tomate tradicional ,37,0.21
nic,1/20/2022,vinagre sabemas claro ,19,0.7
nic,1/20/2022,galleta de maiz sanissimo salmas ,58,0.14
nic,1/20/2022,avena sasa molida ,30,0.4
nic,1/20/2022,miel aunt jemma original pancake ,71,0.36
nic,1/20/2022,galleta nabisco chips ahoy ,90,0.34
nic,1/20/2022,frijol sabemasanel rojo  ,22,0.45
nic,1/20/2022,frijol sabemasano rojo ,47,0.9
nic,1/20/2022,harina de maiz del comal ,39,0.91
nic,1/20/2022,arroz tio pelonano entero  ,71,2.0
nic,1/20/2022,arroz suli aanel  ,16,0.45
nic,1/20/2022,atun suli  pack trocitos en agua,119,0.56
nic,1/20/2022,salsa de soya mccormick ,91,0.3
nic,1/20/2022,mezclaeat value panqueques original ,88,0.91
nic,1/20/2022,harina bollo fino de trigo ,66,2.0
nic,1/20/2022,frijol suli rojo ,93,1.82
nic,1/20/2022,salsaeat value para spaguetti ,92,0.68
nic,1/20/2022,cafe molido segovia puro regular ,105,0.4
nic,1/20/2022,,10,
nic,1/20/2022,consome pollo maggi x,13,0.01
nic,1/20/2022,mostaza hellmanns doy pack ,23,0.2
nic,1/20/2022,aceiteeat value oliva extra virgen ,162,0.75
nic,1/20/2022,flor de jamaica sabemas deshidrata ,41,0.1
nic,1/20/2022,te gv de manzanilla ,22,0.02
nic,1/20/2022,cubito pollo maggi abre facil ,24,0.1
nic,1/20/2022,avena quaker corazon ,34,0.3
nic,1/20/2022,avena quaker mosh hojuelas ,33,0.3
nic,1/20/2022,pasta roma plumas ,21,0.2
nic,1/20/2022,azucar monte rosa sulfitada ,297,10.0
nic,1/20/2022,mostazaeat value,38,0.4
nic,1/20/2022,salsa kern's tomte ketchup doy pack ,35,0.4
nic,1/20/2022,avena sasa en hojuela ,22,0.3
nic,1/20/2022,aceituna rellenas c/ piemiento manz g,50,0.2
nic,1/20/2022,cebada sasa bolsa ,30,0.4
nic,1/20/2022,tajadas laanja de platano ,67,0.3
nic,1/20/2022,avena quaker integral ,33,0.3
nic,1/20/2022,avena quaker nutremas mosh ,77,0.9
nic,1/20/2022,azucar san antonio regular ,60,20.0
nic,1/20/2022,boquitas diana churritos sabr queso,26,0.1
nic,1/20/2022,galleta pozuelo crema rellena vainilla ,46,0.38
nic,1/20/2022,vegetales mixtos herdez lata,32,0.22
nic,1/20/2022, pack galleta marinela principe limon ,67,0.34
nic,1/20/2022,frijol ducal rojo doy pack ,44,0.4
nic,1/20/2022,galleta sanissimo chia linaza g,58,0.14
nic,1/20/2022,pasta anita spaghetti ,13,0.2
nic,1/20/2022,avena quaker molida ,30,0.28
nic,1/20/2022,galleta pozuelo soda  unidades ,28,0.18
nic,1/20/2022,tortilla milpa real ,38,0.18
nic,1/20/2022,tortilla diana de maiz jalapeños ,26,0.16
nic,1/20/2022,lentejas goya ,109,0.4
nic,1/20/2022,aceite ideal soya ,147,1.5
nic,1/20/2022,pasta roma tornillos ,21,0.2
nic,1/20/2022,elote la costeña dorado ,40,0.13
nic,1/20/2022,salsa lizano de vegetales criolla ,54,0.28
nic,1/20/2022,azucar sulfitadaanel  ,14,49.9
nic,1/20/2022,galleta nabisco ritz  .gr,57,0.01
nic,1/20/2022,petit pois herdez en lata ,46,0.21
nic,1/20/2022,arroz sabemas   saco de ,403,10.0
nic,1/20/2022,aceiteeat value soya ,317,3.5
nic,1/20/2022,galleta pozuelo salada club extra ,31,0.22
nic,1/20/2022,vinagre sabemas oscuro botella ,21,0.7
nic,1/20/2022,aceite clover de soya ,200,2.0
nic,1/20/2022,pasta sabemas tornillo twists ,15,0.25
nic,1/20/2022,nestle cheerios® + nesquik® + trix®. cereal  pack g,135,0.53
nic,1/20/2022,champiñones sabemas rebanados ,39,0.18
nic,1/20/2022,boquitas yummies ranchitas natural ,43,0.3
nic,1/20/2022,azucar san antonio regular,299,10.0
nic,1/20/2022,arroz carolinaano entero / ,16,0.4
nic,1/20/2022,arroz / carolina ,191,4.0
nic,1/20/2022,te manzanilla manzate caja  unidades ,165,0.12
nic,1/20/2022,salsa inglesa lea and perrins,104,0.3
nic,1/20/2022,mermelada callejas de guayaba ,47,0.28
nic,1/20/2022,empanizadoranulado kellogg's® corn flakes sabor original  hojuelas de maízanuladas que absorben menosasa que el pan molido   caja de g,49,0.16
nic,1/20/2022,hongos herdez trocitos ,60,0.19
nic,1/20/2022,aceite canolaeat value spray ,82,0.23
nic,1/20/2022,salsaeat value tomate ketchup ,111,1.08
nic,1/20/2022,galleta pozuelo soda salada caja ,66,0.44
nic,1/20/2022, pack papas pringles muelitas original ,190,0.23
nic,1/20/2022,cafe casa del cafe molido house blend ,183,0.45
nic,1/20/2022,harina maseca de maiz  .gr,42,0.02
nic,1/20/2022,arroz sabemas   saco ,476,10.0
nic,1/20/2022,galleta del carmen avena chocolate ,68,0.26
nic,1/20/2022,aceite rico vegetal ,381,5.0
nic,1/20/2022,sandwich hellmanns spreed doy pack ,43,0.2
nic,1/20/2022,te menta manzate caja  unidades  .gr,88,0.0
nic,1/20/2022,salsa ketchup gourmet doy pack ,50,0.8
nic,1/20/2022,manieat value sin sal ,93,0.45
nic,1/20/2022,te verdeeat value ,40,0.02
nic,1/20/2022,achiote molido sol maya ,74,0.2
nic,1/20/2022,boquita yummies zambos chile limon ,43,0.14
nic,1/20/2022,galleta del carmen avena pasas ,68,0.26
nic,1/20/2022,sal sol dorada en bote ,29,0.5
nic,1/20/2022,sabemas arroz bolsa /  ,163,4.0
nic,1/20/2022,nestle corn flakes sin gluten cereal bolsa g,173,0.8
nic,1/20/2022,arroz / faisan ,84,2.0
nic,1/20/2022,pasas bolsa sol maya ,28,0.07
nic,1/20/2022,crema dulce dos pinos  ,47,0.25
nic,1/20/2022,aderezoeat value italian fat fr ,71,0.47
nic,1/20/2022,chicharros la costena en lata,29,0.12
nic,1/20/2022,aceitegreat value oliva light ,99,0.5
nic,1/20/2022,salsa lizano criolla botella ,115,0.7
nic,1/20/2022,coffee mate original sin lactosa sustituto de crema en polvo tarro g,66,0.31
nic,1/20/2022,pasta anita caracolito ,12,0.17
nic,1/20/2022,galleta ritz queso ,81,0.41
nic,1/20/2022,boquita yummies platanos y chicharron ,43,0.15
nic,1/20/2022,mani pro salado bolsa ,19,0.08
nic,1/20/2022,crema tomate maggi ,17,0.08
nic,1/20/2022,salsa lizano picante chilera ,44,0.16
nic,1/20/2022,especie sabemas pimienta y comino en polvo  ,8,0.02
nic,1/20/2022,pasas sabemas bolsa ,31,0.12
nic,1/20/2022,galleta pozuelo tosh coco almendra  .gr,93,0.0
nic,1/20/2022,cerealeat value crispy rice,150,0.55
nic,1/20/2022,ajoeat value picado en aceite ,69,0.23
nic,1/20/2022,ajo sabemas en polvo frasco ,42,0.08
nic,1/20/2022,te jengibre limon miel manzate caja  unidades ,83,0.03
nic,1/20/2022,harina maiz el comal ,181,4.55
nic,1/20/2022,galleta tosh pozuelo limon te verde  .gr,90,0.0
nic,1/20/2022,maiz dulce herdez lata,40,0.22
nic,1/20/2022,salsa tomate sabemas con hongos ,11,0.11
nic,1/20/2022,sardina sardimar dulce g,33,0.16
nic,1/20/2022,chop suey el chinito bolsa ,16,0.11
nic,1/20/2022,frijol blanditos rojo refrito ,26,0.23
nic,1/20/2022,ketchup issima salsa de tomate ,34,0.4
nic,1/20/2022,pasas bolsa sol maya  ,46,0.15
nic,1/20/2022, pack atun suli trocitos en aceite ,112,0.4
nic,1/20/2022,galleta suli soda  unidades ,23,0.19
nic,1/20/2022,harina napoli de trigo para pizza ,14,0.45
nic,1/20/2022,pasta sabemas caracolito,13,0.2
nic,1/20/2022,salsa lizano picante ,27,0.06
nic,1/20/2022,sopa pollo con fideos libre de gluten maggi ,14,0.06
nic,1/20/2022,consome gallina maggi sabor y color x,13,0.01
nic,1/20/2022,galleta oreo cookies nabisco cream ,78,0.43
nic,1/20/2022,vinagre gourmet blanco ,78,3.78
nic,1/20/2022,cerealeat value aros miel ,137,0.61
nic,1/20/2022,consome pollo maggi sabor y color tira x,42,0.01
nic,1/20/2022,oregano badia entero ,52,0.01
nic,1/20/2022,boquitas yummies nacho con queso ,29,0.15
nic,1/20/2022,salsa china mccormick ,91,0.3
nic,1/20/2022,gourmet mayonesa reducia en lpidos,87,0.88
nic,1/20/2022,mani pro garapinado ,21,0.08
nic,1/20/2022,galleta sabemas dulce mantequilla ,53,0.31
nic,1/20/2022,vinagre goya blanco destilado ,137,0.95
nic,1/20/2022,mojo badia marinado,158,0.59
nic,1/20/2022,snack taquerito yummies chile toreado ,35,0.18
nic,1/20/2022,barra de cereal tosh lyne pina g u,119,0.17
nic,1/20/2022,churro diana centavito bolsa ,28,0.11
nic,1/20/2022,sopa maruchan instantanea ramen pollo ,13,0.08
nic,1/20/2022,pasta roma corta cabellos ,37,0.25
nic,1/20/2022,granola naturalez fibra especial ,51,0.28
nic,1/20/2022,mezcla krusteaz pancake muttermilk ,110,0.91
nic,1/20/2022,miel de abeja miss amalie botella ,110,0.34
nic,1/20/2022,aceite ambar de soya ,181,1.89
nic,1/20/2022,sopa nissin instantanea pollo vaso ,20,0.06
nic,1/20/2022,semillas mixtaseat value ,335,0.76
nic,1/20/2022,consome res maggi x,13,0.01
nic,1/20/2022,chocolate gallito tapita  unidades  ,35,0.1
nic,1/20/2022,consome pollo maggi tira x,42,0.01
nic,1/20/2022,ajo en trozos maggi de la huerta frasco g,63,0.08
nic,1/20/2022,boquitas diana quesitos maiz queso,27,0.13
nic,1/20/2022,great value salsa marinara ,79,0.68
nic,1/20/2022,especias sasson pimienta negra ,50,0.06
nic,1/20/2022,consome gallina maggi mi sazon ,13,0.04
nic,1/20/2022,snack yummies taquerito queso fusio ,35,0.18
nic,1/20/2022,boquitas de yucas tostadas hores,67,0.22
nic,1/20/2022,galleta suli salada  unidades ,25,0.19
nic,1/20/2022,maizgreat valuegrano entero ,42,0.43
nic,1/20/2022,papitas yummies estilo clasico,39,0.08
nic,1/20/2022,gelatina royal fresa ,27,0.08
nic,1/20/2022,mayonesa hellmanns pura doy pack ,45,0.2
nic,1/20/2022,salsa suli vegetales tipo inglesa,51,0.7
nic,1/20/2022,comino sol maya en polvo ,19,0.01
nic,1/20/2022,siropeeat value maple suga free ,79,0.71
nic,1/20/2022,vegetaleseat value mixtos ,40,0.42
nic,1/20/2022,aceite olivaeat value spray ,111,0.2
nic,1/20/2022,empanizador los patitos de pollo ,25,0.1
nic,1/20/2022,sweet peaseat value en lata ,40,0.42
nic,1/20/2022,galleta sabemas maria ,19,0.17
nic,1/20/2022,pasta macarron roma ,26,0.25
nic,1/20/2022,frijol naturas molido rojo ,52,0.4
nic,1/20/2022,miel el panal de abeja botella ,129,0.35
nic,1/20/2022,premezcla jinca para pancake gfree,83,0.45
nic,1/20/2022,galleta navidad sams choice lata,98,0.34
nic,1/20/2022,cremaeat value para cafe original ,145,1.0
nic,1/20/2022,palomitas act ii mantequilla extra ,46,0.09
nic,1/20/2022,paleta ricolino payaso malvav mini,15,0.02
nic,1/20/2022,endulzanteeat value steviaanulada ,180,0.28
nic,1/20/2022,avena sabemas integral ,81,1.0
nic,1/20/2022,flan sabemas vainilla con caramelo ,27,0.13
nic,1/20/2022,mayonesa alolivo con aceite de oliva ,91,0.4
nic,1/20/2022,fruta mixtaeat v triple cereza ,70,0.42
nic,1/20/2022,bridge colombina fresa bs,41,0.03
nic,1/20/2022,atun gaviota lomo trocitos c veget,49,0.1
nic,1/20/2022,salsa naturas ketchup ,99,0.79
nic,1/20/2022,naturas salsa tomate con queso ,18,0.11
nic,1/20/2022,galleta sanissimo arroz quinoa sal ,93,0.11
nic,1/20/2022,galleta pozuelo soda integral paquete  unidades ,31,0.18
nic,1/20/2022,papas onduladas gv originales ,77,0.22
nic,1/20/2022,harina maiz pan precoc blanco ,194,1.0
nic,1/20/2022,pimienta maggi de la huerta frasco g,63,0.06
nic,1/20/2022,pasta sabemas lengua,13,0.2
nic,1/20/2022,achiote sabemas molido ,10,0.02
nic,1/20/2022,chocolate schogetten oscuro amargo ,59,0.1
