country,date,name,price,weight
ni,3/4/2022, pack cepillo dental colgate slim soft,121,
ni,3/4/2022, pack hilo dental colgate total  m,122,
ni,3/4/2022,crema dental oral b baking soda,105,0.15
ni,3/4/2022,retocador raíz nutrisse rubio oscuro . ,82,0.02
ni,3/4/2022,agua micelar cicatricure trifasica,396,0.4
ni,3/4/2022,toalla equate facial sensitive   unidades,125,
ni,3/4/2022, pack jabón de tocador equate yogurt & arándano ,51,0.44
ni,3/4/2022,jabon eq liquido antibacterial ,45,0.52
ni,3/4/2022,esponja equate mesh con base de goma,82,
ni,3/4/2022,agua micelar nivea de rosas ,300,0.4
ni,3/4/2022,set de viaje equate  pc ea,80,
ni,3/4/2022,vinagregreat value sidra manzana ,59,0.95
ni,3/4/2022,polvoeat value de hornear ,40,0.23
ni,3/4/2022,siropeeat value maple suga free ,79,0.71
ni,3/4/2022,palomitas act ii mantequilla extra ,48,0.09
ni,3/4/2022,salsa prego de tomate con hongo ,164,0.68
ni,3/4/2022,galleta sanissimo arroz integral ,94,0.11
ni,3/4/2022,aceitegreat value oliva extra virgen ,118,0.5
ni,3/4/2022, pack galleta principe fresa ,67,0.34
ni,3/4/2022,atun calvo trozos con vegetales ,75,0.1
ni,3/4/2022,harina maiz maseca con especias ,37,0.45
ni,3/4/2022,botonetas best chocolate  bolsitas ,50,0.16
ni,3/4/2022,consome pollo maggi ,127,0.85
ni,3/4/2022,canela en astilla sol maya gr,14,0.01
ni,3/4/2022,condimento badia sazon completo ,231,0.34
ni,3/4/2022,cepillo oral b  beneficios control bac,134,
ni,3/4/2022,alcohol germi fin en gel antibacterial ,177,1.0
ni,3/4/2022,garnier fructis hairfood mask aloe ,220,0.35
ni,3/4/2022,cepillo equate rectangular negro   unidad,60,
ni,3/4/2022,rodillo quitapelusa equate  hojas ea,45,
ni,3/4/2022,acondicionador t infusion keratina,261,0.75
ni,3/4/2022,jabon liq solenti bio belleza,90,0.45
ni,3/4/2022,equate antifaz de gel   unidad,58,
ni,3/4/2022,cepillo de bolsillo equate con espejo  unidad,33,
ni,3/4/2022,garnier fructis hairfood mask coconut ,220,0.35
ni,3/4/2022,saba toallas humedas natural x ,44,
ni,3/4/2022,shampoo equate beauty argan oil ,230,1.0
ni,3/4/2022,desodorante rexona barra antibacterial fresh ,59,0.05
ni,3/4/2022,crema facial nivea antiarrugas ,115,0.1
ni,3/4/2022,enjuague equate bucal spring ,130,1.5
ni,3/4/2022,acondicionador herbal essences argan oil ,333,0.4
ni,3/4/2022,maizgreat valuegrano entero ,42,0.43
ni,3/4/2022,chocolate nucita nutresa trisabor dispenz ,45,0.14
ni,3/4/2022,paleta colombina tipitin besos ,53,0.29
ni,3/4/2022,nestle cheerios® miel cereal g caja,140,0.48
ni,3/4/2022,pasas bolsa sol maya ,96,0.25
ni,3/4/2022,mermelada sabemas guayaba ,51,0.3
ni,3/4/2022,salsa del monte sabor a queso ,51,0.4
ni,3/4/2022,paleta coronado de cajeta tira   unidades ,41,0.01
ni,3/4/2022,bebida quaker frescavena de fresa ,47,0.33
ni,3/4/2022, packeat value palomita microonda extmantequilla ,77,0.08
ni,3/4/2022,boquitas de yucas tostadas hores,67,0.22
ni,3/4/2022,sason sasson completa sobre ,25,0.05
ni,3/4/2022,barra bimbo multigrano nuez ,85,0.2
ni,3/4/2022,papitas yummies estilo clasico,41,0.08
ni,3/4/2022,salsa inglesa mccormick ,55,0.15
ni,3/4/2022,te jengibre limon mondaisa caja undm,72,0.03
ni,3/4/2022,pasta macarron roma ,26,0.25
ni,3/4/2022,frijol blanditos rojo refrito ,36,0.45
ni,3/4/2022,desodor nivea spray men real impactml,105,0.15
ni,3/4/2022,garnier shampoo fructis hair food aloe ,250,0.3
ni,3/4/2022,nueva crema para peinar pantene prov liso extremo ml,135,0.3
ni,3/4/2022,tio nacho shampoo aloe,203,0.42
ni,3/4/2022,conditioner head shoulder charcoal,225,0.3
ni,3/4/2022,crema nivea hidratación express ,532,1.0
ni,3/4/2022,pack equate clean care  cep  cobertor,45,
ni,3/4/2022, pack jabon dove antibacterial ,186,0.09
ni,3/4/2022,gel nivea facial limpieza rosas ,301,0.15
ni,3/4/2022, pack desodorante rexona aerosol ap v men ,154,0.18
ni,3/4/2022,acondicionador pantene prov restauración ,199,0.4
ni,3/4/2022,shampoo head & shoulders alivio refrescante ,237,0.38
ni,3/4/2022,cepillo dental equate gusanito para bebé   unidad,28,
ni,3/4/2022,shampoo head & shoulders old spice para hombres,51,0.09
ni,3/4/2022,elvive óleo extraordinario nutrición universal ,147,0.1
ni,3/4/2022,crema cicatricure beauty care,566,0.05
ni,3/4/2022,crema nivea corp piel extra seca,528,1.0
ni,3/4/2022,pasta ina linguini ,14,0.2
ni,3/4/2022,miel de abeja biibii africanizada ,145,0.5
ni,3/4/2022,cafe molid sn sebastian oscur prem,140,0.4
ni,3/4/2022,te verde naranja jengibre manzate caja  unidades ,98,0.03
ni,3/4/2022,endulzanteeat value steviaanulada ,180,0.28
ni,3/4/2022,chimichurri secret d mama jalapeno,134,0.25
ni,3/4/2022,maggi sopa criolla de gallina con caracolitos sobre g,12,0.06
ni,3/4/2022,curcuma sol maya ,114,0.1
ni,3/4/2022,maggi sazonador de res  sobres de g,13,0.01
ni,3/4/2022,maggi crema de mariscos sobre g,17,0.08
ni,3/4/2022,maggi crema de espárragos sobre g,17,0.07
ni,3/4/2022,cheetos crunchy snaks .oz,36,
ni,3/4/2022,pringles orginal g,22,0.02
ni,3/4/2022,aceite clover de girasol ,549,4.73
ni,3/4/2022,sopa gv bolsa sabor pollo,10,0.08
ni,3/4/2022,desodorante dove spray dermo aclarante ,96,0.15
ni,3/4/2022,shampoo head & should old spice ,354,1.0
ni,3/4/2022,repuestos para afeitar gillette venus original   unidades,184,
ni,3/4/2022,shampoo elvive oleo extraordinario nutricion profunda ,147,0.4
ni,3/4/2022,jabon tocad equate limpi total pk,51,0.44
ni,3/4/2022,shampoo dove control caida,162,0.4
ni,3/4/2022,toalla kotex up con alas manzanilla un,33,
ni,3/4/2022,ora indicator color collection cepillos dentales suave   unidades,138,
ni,3/4/2022,acondicionador pantene prov rizos definidos ,199,0.4
ni,3/4/2022,rasuradora equate mango de goma homb u,85,
ni,3/4/2022,protector diario saba confort con alas   unidades,62,
ni,3/4/2022,espuma afeitar nivea sensible ,304,0.2
ni,3/4/2022,shampoo pantene prov micelar purifica & hidrata,199,0.4
ni,3/4/2022,crema anti manchas loreal dermo hy,295,0.05
ni,3/4/2022,kit máquina para afeitar desechable gillette mach turbo  unidad + repuesto  unidad,184,
ni,3/4/2022,rasuradora gillette desechable prest u,59,
ni,3/4/2022,eq rasuradora sistema hom  hojas ud,101,
ni,3/4/2022,tallarin sabemas precocido ,29,0.2
ni,3/4/2022,chocolate gallito milán  unidades  .,45,0.01
ni,3/4/2022,granola tosh semillas y chia ,91,0.3
ni,3/4/2022,aceitegreat value oliva puro ,97,0.5
ni,3/4/2022,sopa casera pollo con verduras maggi ,18,0.09
ni,3/4/2022,galleta marinela dulce maria tubo ,21,0.14
ni,3/4/2022,salsa lizano ,148,1.0
ni,3/4/2022,papaseat value tubo cebolla ,64,0.16
ni,3/4/2022,salsa naturas ketchup ,99,0.79
ni,3/4/2022,sopa nissin instantanea de camaron vaso ,22,0.06
ni,3/4/2022,dip lactolac cebolla y finas hierbas ,65,0.23
ni,3/4/2022,oregano sabemas en hojas ,7,0.0
ni,3/4/2022,endulzanteeat value stevia  sobres ,125,0.16
ni,3/4/2022,cerealeat value avena miel ,100,0.51
ni,3/4/2022,harina espiga dorada todo uso ,77,2.27
ni,3/4/2022,shampoo pantene prov rizos definidos ,199,0.4
ni,3/4/2022,gel de cabello equate ,63,0.9
ni,3/4/2022,cepillo dent ora stages  a  anos,82,
ni,3/4/2022,cartuchos repuesto equate para rasuradora hombre  hojas   unidades,133,
ni,3/4/2022,elvive óleo extraordinario coco crema para peinar ,155,0.3
ni,3/4/2022,jabon nivea intimo natural,272,0.25
ni,3/4/2022,toalla sanitaria saba buenas noches u,76,
ni,3/4/2022,mascarilla garnier hidrabom revitalizant,92,
ni,3/4/2022,acondicionador elvive rizos ,147,0.4
ni,3/4/2022,protector saba diario multiestilo   unidades,59,
ni,3/4/2022,desodorante barra rexona men invisible ,59,0.05
ni,3/4/2022, pack jabon dk antibacterial coco barra ,80,0.11
ni,3/4/2022,toalla sanitaria saba ultradelg c ala ,51,
ni,3/4/2022,elvive shampoo dream long ,146,0.4
ni,3/4/2022,desodorante dove aerosol dama ,96,0.15
ni,3/4/2022,crema peinar elvive reparac total,155,0.3
ni,3/4/2022,shampoo dove nutricion oleo micelar ,162,0.4
ni,3/4/2022,desodorante spray old spice mar profundo ,122,0.15
ni,3/4/2022,hoja de laurel sol maya molido,21,0.01
ni,3/4/2022,vino tinto de cocinar la vi§a .oz,191,
ni,3/4/2022,empanizador los patitos de pollo ,25,0.1
ni,3/4/2022,boquitas yummies zambo salsa verde ,47,0.14
ni,3/4/2022,gv duplexcrema choco vainil rellenagr,99,0.71
ni,3/4/2022,dip lactolac blue cheese y eneldo ,55,0.23
ni,3/4/2022,palmito richly entero ,179,0.22
ni,3/4/2022,cereal tosh multicereal yogurtiego caja ,145,0.3
ni,3/4/2022,papas pringles queso ,92,0.12
ni,3/4/2022,mani pro con chile bolsa ,21,0.08
ni,3/4/2022,boquitas yummies nacho con queso ,28,0.15
ni,3/4/2022,salsa picante chilango jolokia ,77,0.15
ni,3/4/2022,barra brander de ajonjoli krunchy ,62,0.18
ni,3/4/2022,linaza entera sol maya ,227,0.6
ni,3/4/2022,especias sasson pimienta negra ,50,0.06
ni,3/4/2022,gourmet mayonesa reducia en lpidos,87,0.88
ni,3/4/2022,salsa biibii bbq con miel y chile ,85,0.3
ni,3/4/2022,hoja de laurel sol maya bolsa ,52,0.03
ni,3/4/2022,gel fijador ego power ,142,1.0
ni,3/4/2022,gel ego control caída ,46,0.23
ni,3/4/2022,pasta dental ora encías detox ,140,0.08
ni,3/4/2022,cepillo dent equate gusanito mas estuche,39,
ni,3/4/2022,hilo oral b dental cera con fluor  und,124,
ni,3/4/2022,shampoo head shoulders manza fresh,237,0.38
ni,3/4/2022,elvive dream long liss crema de peinar,147,0.3
ni,3/4/2022,repuesto rasuradora equate e max   unidades,190,
ni,3/4/2022,shampoo head&shoulders protec caid ,237,0.38
ni,3/4/2022,garnier nutrisse nourishing color ,163,
ni,3/4/2022,desodorante dove spray men clean comfort ,96,0.15
ni,3/4/2022,desodor dove spray cab extra fresh,96,0.15
ni,3/4/2022,conditioner head shoulder antifall,225,0.3
ni,3/4/2022,crema marlen lamur corporal vainilla ,128,1.0
ni,3/4/2022,toalla saba confort nocturna manzani u,64,
ni,3/4/2022,toalla saba buenas noches extra larga,141,
ni,3/4/2022,extra max rasuradora triple hoja ea,12,
ni,3/4/2022,panueloeat value facial u,63,
ni,3/4/2022,pozuelo galleta realezas ,51,0.28
ni,3/4/2022,sazon con azafran goya caja de . oz,132,
ni,3/4/2022,ajo molido sol maya frasco ,95,0.04
ni,3/4/2022,aderezo campestre italiano ,45,0.2
ni,3/4/2022,pasta sabemas caracolito,13,0.2
ni,3/4/2022,papitas yummies crema y espec,41,0.08
ni,3/4/2022,mermelada sabemas piña bolsa ,35,0.3
ni,3/4/2022,barra de cereal tosh lyne fresa g u,119,0.17
ni,3/4/2022,pasta roma larga espaguetti ,44,0.5
ni,3/4/2022,hongos richly enteros ,61,0.42
ni,3/4/2022,chile jalapeño herdez rajas escabeche,37,0.22
ni,3/4/2022,pasta roma mediana pluma tricolor ,41,0.25
ni,3/4/2022,mezcla pancake betty crocker original ,150,1.04
ni,3/4/2022,granola alin pasas bolsa ,45,0.25
ni,3/4/2022,aceite ambar de soya ,189,1.89
ni,3/4/2022,aceite ideal soya omega y ,357,3.75
ni,3/4/2022,picadillos de cebolla mama gollita ,81,0.45
ni,3/4/2022,bifasico loreal dermo exp hyd to ,249,0.12
ni,3/4/2022,crema nivea lata,36,0.02
ni,3/4/2022,conair plancha ceramica tratam ac argan,500,
ni,3/4/2022,desodorante speed stick / xtreme intense barra  g,61,0.05
ni,3/4/2022,shampoo palmolive naturals complete repair ,113,0.75
ni,3/4/2022, packcepillo dental colgate ° advanced luminous white,149,
ni,3/4/2022,crema sedal negro luminoso ,89,0.3
ni,3/4/2022,crema veet depilatoria piel normal ,366,0.1
ni,3/4/2022,desodor rexona barra clinical fresh,135,0.05
ni,3/4/2022,crema lubriderm protección solar ,315,0.2
ni,3/4/2022,set rosario bendek antifaz tapones y almohada,125,
ni,3/4/2022,desodorante axe excite stick barra ,76,0.05
ni,3/4/2022,desodorante rexona women clinical extra dry ,135,0.05
ni,3/4/2022,crema teatrical facial antiarrugas,96,0.2
ni,3/4/2022,gel attraction xtreme hombre envase ,42,0.25
ni,3/4/2022,jabon liquido intimo lactacyd bio deli,340,
ni,3/4/2022,rb pack tag para viaje simulacion cuero,75,
ni,3/4/2022,tela after spa strech,49,
ni,3/4/2022,gelatina royal cereza ,16,0.04
ni,3/4/2022,chao mein cantonesa ,16,0.12
ni,3/4/2022,arroz goya integral bolsa ,100,0.79
ni,3/4/2022,consome camaron maggi ,42,0.01
ni,3/4/2022,galleta nabisco avena pasas molida ,85,0.34
ni,3/4/2022,maggi sopa de pollo con fideos libre de gluten sobre g,14,0.06
ni,3/4/2022,galleta cuetara campechanas ,40,0.23
ni,3/4/2022,boquitas frito lay doritos nachos ,38,0.15
ni,3/4/2022,salsa ajomix mccormick ,47,0.15
ni,3/4/2022,maggi mi sazón sabor a pollo  sobres de g,13,0.01
ni,3/4/2022,cheerios manzana canela cereal caja g,132,0.48
ni,3/4/2022,maggi sazonador gallinita sabor y color  sobres de g,13,0.01
ni,3/4/2022,crunch cereal caja g,143,0.33
ni,3/4/2022,maggi de la huerta canela en polvo bolsa resellable g,31,0.03
ni,3/4/2022,maggi sopa de cola de res sobre g,19,0.08
ni,3/4/2022,barra nature valley crujiente avena y miel ,140,0.25
ni,3/4/2022,mani brander japones ,36,0.08
ni,3/4/2022,desodorante nivea barra dama black white ,95,0.05
ni,3/4/2022,desodorante nivea barra men black white ,95,0.05
ni,3/4/2022,crema lubriderm formula extra hume,247,0.2
ni,3/4/2022,shampoo dove reconstruccion completo ,162,0.4
ni,3/4/2022,creme nivea men multiuso l,97,
ni,3/4/2022,acondicionador sedal ceramidas,112,0.34
ni,3/4/2022,máquinas para afeitar desechables gillette prestobarba ultragrip   unidades,262,
ni,3/4/2022,venus simply  sensitive x,98,
ni,3/4/2022,nuvel crema coco mas  porciento,74,0.62
ni,3/4/2022,crema facial nivea tarro plastico ,121,0.1
ni,3/4/2022,shamp john frid friz beyon smooth,313,0.25
ni,3/4/2022,tinte koleston wel castaño mediano   unidad,158,
ni,3/4/2022,protector kotex diario days largo   unidades,92,
ni,3/4/2022,desodorante nivea rollon silver men ,65,0.05
ni,3/4/2022,toalla kotex nocturna con alas  unidad,83,
ni,3/4/2022,tratam nevada argan oil repara,290,1.0
ni,3/4/2022,gel fijador ego men urban,46,0.25
ni,3/4/2022,cereal kelloggs komplete almendra g,172,0.39
ni,3/4/2022,ketchup issima salsa de tomate ,29,0.4
ni,3/4/2022,chocolate bon o bon arcor leche g,105,0.22
ni,3/4/2022,flan sabemas vainilla con caramelo ,27,0.13
ni,3/4/2022,frijol ducal volteado negro doy pack ,44,0.4
ni,3/4/2022,chocolate schogetten oscuro amargo ,59,0.1
ni,3/4/2022,gelatina royal naranja ,29,0.08
ni,3/4/2022,vinagre don julio condimentado ,34,0.48
ni,3/4/2022,almendraseat value natural ,350,0.71
ni,3/4/2022,arroz nicoya   libras,438,
ni,3/4/2022,consome favora de pollo ,149,0.91
ni,3/4/2022,galleta pozuelo soda integral paquete  unidades ,31,0.18
ni,3/4/2022,te canela manzate caja  unidades  .gr,87,0.0
ni,3/4/2022,sopa nissin instantanea de camaron picante vaso ,22,0.06
ni,3/4/2022,tinte palett cc d oscuro a rubio,126,0.11
ni,3/4/2022,desodor dove barra aclarado perfect,74,0.05
ni,3/4/2022,body splash jacquidavid pass love,255,0.24
ni,3/4/2022,ttaio relax guant para bano tela stretch,34,
ni,3/4/2022,body splash jacquidavid forever,255,0.24
ni,3/4/2022,spray fijado smooth shine control,198,0.3
ni,3/4/2022,acondic fructis oil repair,122,0.35
ni,3/4/2022,algodîn torunda jaloma de  bolitas,40,
ni,3/4/2022,locionisi dese kid berinaiz ,102,0.25
ni,3/4/2022,conair secadora de pelo ionica,900,
ni,3/4/2022,crema cicatricure contorno de ojos  .gr,328,0.0
ni,3/4/2022,remover equate makeup cleansing tow   unidades,125,
ni,3/4/2022,jabon ludwig w limon botella,70,0.3
ni,3/4/2022,jabon ludwig w fresa botella,70,0.44
ni,3/4/2022,rasuradora bic comfort hybrid  hojas   unidades,214,
ni,3/4/2022,rasuradora bic flex  hojas extra suave  unidades,112,
ni,3/4/2022,"crema goicochea elastina, colágeno y frutos",299,
ni,3/4/2022,harina napoli de trigo para pizza ,13,0.45
ni,3/4/2022,marshmelloweat value sabor vainilla ,50,0.28
ni,3/4/2022, packeat value fruta mixta sin azucar ,110,0.43
ni,3/4/2022,sal natural de mar fina alessi,141,0.68
ni,3/4/2022,salsaeat value espesa picante medio ,95,0.68
ni,3/4/2022,nuezeat value nogal en mitades ,150,0.2
ni,3/4/2022,paprikaeat value molida ,190,0.45
ni,3/4/2022,harina de maiz del comal ,39,0.91
ni,3/4/2022,boquitas frito lay sour cream ,145,0.18
ni,3/4/2022,cereal malt o meal marshmallow ,89,0.34
ni,3/4/2022,papaseat value tubo queso ,64,0.16
ni,3/4/2022,manieat value con sal ,93,0.45
ni,3/4/2022,aceituna goya rellena manzanilla,69,0.05
ni,3/4/2022,pringles wavi jalapena  g,104,0.14
ni,3/4/2022,salsa tomate sabemas con carne ,11,0.11
ni,3/4/2022,jabon liq equate laven cham repue,100,1.65
ni,3/4/2022,hidratante nivea matificante fps,430,0.05
ni,3/4/2022,estuche equate protector dental   unidad,25,
ni,3/4/2022,crema equate facial aaricoque  ,80,0.17
ni,3/4/2022,crema loreal humectante antiarrugas ,377,0.05
ni,3/4/2022,máquina para afeitar recargable gillette styler en  unidad,1,
ni,3/4/2022,tratamiento restauracion pantene,166,0.3
ni,3/4/2022,tratam pantente pro v restaurac,166,0.3
ni,3/4/2022,enjuague bucal colgate total  spray ,162,0.06
ni,3/4/2022,shampoo equate everyday clean  en ,150,0.4
ni,3/4/2022,enjuague bucal colgate plax kids  ,164,0.25
ni,3/4/2022,gel tatto maybelline cejas brown tint un  medium   unidad,660,
ni,3/4/2022,gel tatto maybelline semipermantente cejas light brown   unidad,660,
ni,3/4/2022,empanizador sabemas ,25,0.06
ni,3/4/2022,tomillo sm entero bolsa,18,0.01
ni,3/4/2022,galleta pozuelo cremas dark ,66,0.4
ni,3/4/2022,cremaeat value de avellanas ,250,0.65
ni,3/4/2022,nestle fitness® frutas cereal g caja,144,0.35
ni,3/4/2022,cereal suli arroz chocolate ,141,1.2
ni,3/4/2022,salsa mexicana herdez de guacamole,82,0.24
ni,3/4/2022,paleta colombina tipitin surtido sabores ,36,0.18
ni,3/4/2022,linaza molida sabemas ,57,0.4
ni,3/4/2022,vino blanco de cocinar la vi§a .oz,191,
ni,3/4/2022,chocolate hersheys milk giantbar ,175,0.2
ni,3/4/2022,boquitas jacks meneitos clasicos ,56,0.12
ni,3/4/2022,pimienta sasson negra ,25,0.03
ni,3/4/2022,galleta bridge naranja colombina ,52,0.3
ni,3/4/2022,chimichurri el secreto de mama,126,0.25
ni,3/4/2022,harina de maiz del comal fortifica ,19,0.45
ni,3/4/2022,labial maybelline matte ink lover    unidad,370,0.0
ni,3/4/2022,alcohol germi fin antibacterial spray ,87,0.14
ni,3/4/2022,spray loreal magic retouch clor rub,249,0.08
ni,3/4/2022,agua micelar asepxia carbon,255,0.4
ni,3/4/2022,hair food acondicionador aguacate ,250,0.3
ni,3/4/2022,jabón líquido para manos lysol skin care doypack ,84,0.22
ni,3/4/2022,tratamiento elvive crema oleo,180,0.3
ni,3/4/2022,ganchos equate para el cabello und,20,
ni,3/4/2022,desodorante dove spray go fresh pep te ,96,0.15
ni,3/4/2022,shampoo calypso kids fresa cereza,95,0.36
ni,3/4/2022,rexona jab antibacterial avena pk g,61,0.12
ni,3/4/2022,crema dental colgate sensitive encias g,173,0.09
ni,3/4/2022,acondicionador herbal essences moring oil ,333,0.4
ni,3/4/2022,cepillo equate de madera u,110,
ni,3/4/2022,rasuradora para mujer equate h  pza,48,
ni,3/4/2022,head & shoulders relax control comezón con eucalipto shampoo control caspa,295,0.7
ni,3/4/2022,salsa lizano picante chilera ,44,0.16
ni,3/4/2022,aceite colavita de oliva,216,1.0
ni,3/4/2022,mermelada sabemas de mora bolsa ,34,0.3
ni,3/4/2022,galleta diana picnic vainilla ,27,0.16
ni,3/4/2022,sazonador badia naranja agria ,186,0.57
ni,3/4/2022,clavo sol maya de olor bolsa ,45,0.01
ni,3/4/2022,ajo listo don julio ,94,0.33
ni,3/4/2022,mostaza regia ,64,0.96
ni,3/4/2022,gomitas ricolino panditas acidos ,37,0.12
ni,3/4/2022,sopa gv vaso sabor carne,18,0.06
ni,3/4/2022,tallarín dragon precocido ,47,0.22
ni,3/4/2022,cajeta de coco negro el carmen  .gr,32,0.08
ni,3/4/2022,especia sasson sazon completa ,50,0.08
ni,3/4/2022,gelatina sabemas sabor limon ,12,0.04
ni,3/4/2022,confites nucita nutresa trisabor ,14,0.02
ni,3/4/2022,salsa del monte tomate tradicional ,51,0.4
ni,3/4/2022,barra brander de nueces mixtas krunchy bar ,88,0.16
ni,3/4/2022,platano pro madouro ,70,0.16
ni,3/4/2022,desodorante rexona spray motions invisible antbacterial,83,0.15
ni,3/4/2022,sedal sh bomba coco xml crpentml,112,0.34
ni,3/4/2022,pack colgate smiles pasta dental  + cepillo batman/wonder woman,132,0.08
ni,3/4/2022,base maybelline liquida fit matte pore warm nude    unidad,390,0.03
ni,3/4/2022,rasuradora bic comfort  black night bu,71,
ni,3/4/2022,cream equate dry skin moisturizing,60,0.45
ni,3/4/2022,equate cepillo redondo,40,
ni,3/4/2022,concealer age maybelline rewind honey   unidad,617,0.01
ni,3/4/2022,l'oreal magic retouch castaño claro,249,
ni,3/4/2022,cepillos oral b interdentales expert,89,
ni,3/4/2022,protector solar nivea sun hidratacion f,391,0.2
ni,3/4/2022,kit remington cortadora cuidado personal,1,
ni,3/4/2022,sedal sh carbon y peon xml cpp,112,0.34
ni,3/4/2022,pasta dental colgate smiles justice league ,48,0.06
ni,3/4/2022,pasta dental colgate triple acción xtra blancura ,81,0.12
ni,3/4/2022,"cereal kellogrgr's® special k® equilibrio™ sabor vainilla con almendras  cereal de trigro, maíz, arroz, avena y salvado de trigro con almendras   c",155,
ni,3/4/2022,guandy malvavisco chocolate hipo,18,0.03
ni,3/4/2022,cereal kelloggs cron flakes g,150,0.5
ni,3/4/2022,pasta ina espaguetti ,15,0.2
ni,3/4/2022,sopa gallina criolla knorr ,10,0.05
ni,3/4/2022,cafe las flores enano tuest med,380,0.91
ni,3/4/2022,aceite ideal de soya ,71,0.8
ni,3/4/2022,frijol blanditos rojo entero,29,0.45
ni,3/4/2022,pinolillo segovia ,33,0.4
ni,3/4/2022,frijoles naturas rojos volteados ,87,0.8
ni,3/4/2022,mini gelatina  siete de frutas,35,0.31
ni,3/4/2022,avena el caracol molida ,37,0.45
ni,3/4/2022,harina jinca foods de arroz ,56,0.45
ni,3/4/2022,frijol goya negro entero premium ,177,0.82
ni,3/4/2022,mermelada helios de fresa extra ,55,0.34
ni,3/4/2022,garbanzos goya bolsa ,143,0.4
ni,3/4/2022,desodorante lady speed stick / powder fresh barra  g,61,0.04
ni,3/4/2022,desodorante lady speed stick derma + aclarado perla aerosol   g,49,0.06
ni,3/4/2022, pack cepillo dental colgate smiles minions + años,131,
ni,3/4/2022,jabón de tocador palmolive naturals tono perfecto nacar y vitamina c  g  pack,94,0.1
ni,3/4/2022, pack jabón de tocador palmolive naturals sensación humectante oliva y aloe  g,60,0.1
ni,3/4/2022, pack jabón de tocador palmolive naturals suavidad natural yoghurt y frutas   g,60,0.1
ni,3/4/2022,pasta dental colgate natural extracts purificante carbón activado  ,67,0.06
ni,3/4/2022,shampoo herbal essences con aloe y sea ke,333,0.25
ni,3/4/2022, pack cepillo dental colgate ° antibacterial,130,
ni,3/4/2022, pack cepillo dental colgate colors,123,
ni,3/4/2022,spray corporal antibacterial protex duo protect ,134,0.18
ni,3/4/2022,desodorante speed stick classic barra   g,61,0.05
ni,3/4/2022,desodorante lady speed stick orchard blossom barra  g,61,0.04
ni,3/4/2022,desodorante speed stick hipoalergénico barra  g,61,0.05
ni,3/4/2022, pack cepillo dental colgate pro cuidado,125,
ni,3/4/2022, pack cepillo dental colgate ° sensitive proalivio extra suave,130,
ni,3/4/2022,enjuague bucal colgate total clean mint  ,312,0.5
ni,3/4/2022,concealer maybelline age rewind  golde   unidad,617,0.14
ni,3/4/2022,mermelada helios arandanos extra,77,0.34
ni,3/4/2022,salchicha delmor viena res ,42,0.1
ni,3/4/2022,paletas colombina tipitin cervecita ,54,0.29
ni,3/4/2022,corn flakes sin gluten cereal caja g,101,0.4
ni,3/4/2022,empanizador los patitos de hierbas ,15,0.08
ni,3/4/2022,salsa de soya mccormick ,56,0.15
ni,3/4/2022,avena quaker mosh mas pichel pack g,82,0.9
ni,3/4/2022,fitness miel & almendras cereal caja g,146,0.39
ni,3/4/2022,empanizador c sazonado de pan .gr,86,0.39
ni,3/4/2022,hongos champiñones toños trozos y tallos ,64,0.18
ni,3/4/2022,especias sasson ajo puro ,50,0.06
ni,3/4/2022,atlantida sal parrillera,36,1.0
ni,3/4/2022,barras kellogrgr's® special k® cosecha roja sabor fresa   caja de con  barras,126,0.14
ni,3/4/2022,barras kelloggs ricekrispies treats con  vitaminas ,115,0.13
ni,3/4/2022,tortilla fritolays tortrix limón,32,0.18
ni,3/4/2022,lasagna sabemas caja,57,0.3
ni,3/4/2022,tinte igora vital  cafe,195,0.05
ni,3/4/2022,desodorante gillette barra clear gel sport g,134,0.08
ni,3/4/2022,rasuradora p mujer equate e max  pza,230,
ni,3/4/2022,tinte igora vital kit   cafe moca g,195,0.05
ni,3/4/2022,tinte igora vital  chocolate,195,0.05
ni,3/4/2022,sahmpoo herbal essences con aloe y sea ke,333,0.4
ni,3/4/2022,hair mask fructis hair food aloe,220,0.35
ni,3/4/2022,crema marlen lamur corporal familiar ,128,1.0
ni,3/4/2022,jabon de tocador  dk cremoso,80,0.4
ni,3/4/2022,plancha remington de cabello ceramica,1,
ni,3/4/2022,desodorante axe chill pack,118,0.15
ni,3/4/2022,shampoo elvive rizos definidos óleo ,230,0.68
ni,3/4/2022,nivea deo roll on espresso,65,0.05
ni,3/4/2022,atun calvo trocitos en aceite ,73,0.14
ni,3/4/2022,galleta pozuelo maria dulce  ,25,0.17
ni,3/4/2022,chocolate vizzio costa con almendras ,68,0.07
ni,3/4/2022,willy marsmelo formas corazon flor ,165,0.43
ni,3/4/2022,salsita naturas de tomate ranchera ,18,0.11
ni,3/4/2022,sucralosaeat valueanulada ,135,0.28
ni,3/4/2022,sardina sabemas en salsa tomate picante ,31,0.16
ni,3/4/2022,edulcorante splenda cajas ,381,0.2
ni,3/4/2022,coctel frutaeat value extra light ,70,0.42
ni,3/4/2022,salsa kern's preparada ranchera ,16,0.11
ni,3/4/2022,atun suli trocitos en aceite ,39,0.14
ni,3/4/2022,guisanteeat value sin sal ,40,0.42
ni,3/4/2022,barraeat valueanola masticable mani salado y dulce ,103,0.21
ni,3/4/2022,dulce venus candy mix bolsa ,165,1.36
ni,3/4/2022,retocador raíz nutrissenegro . ,82,0.02
ni,3/4/2022,retocador raíz nutrisse castaño oscuro . ,82,0.02
ni,3/4/2022,retocador raíz nutrisse rcastaño claro . ,82,0.02
ni,3/4/2022,retocador raíz nutrisse rubio cenizo . ,82,0.02
ni,3/4/2022,cortadora remington de cabello kit viaje,990,
ni,3/4/2022,alisadora remington cabello humedo seco,2,
ni,3/4/2022,cortador remington de cabello chrome acero inoxidable,990,
ni,3/4/2022,multistyler remigton cabello  en,2,
ni,3/4/2022,bloq nivea face prot lig fps,228,0.05
ni,3/4/2022,remington alisadora terapia acuacate,3,
